;SentenceId;PhraseId;Phrase;Sentiment
2908;2911;57752;Some people march to the beat of a different drum , and if you ever wondered what kind of houses those people live in , this documentary takes a look at 5 alternative housing options .;3
2591;2592;52405;I have n't laughed that hard in years !;4
2247;2248;46178;It remains to be seen whether Statham can move beyond the crime-land action genre , but then again , who says he has to ?;2
3197;3200;63273;There 's no denying that Burns is a filmmaker with a bright future ahead of him .;4
2981;2984;59146;This Scarlet 's letter is A. . .;2
2249;2250;46223;It shows that some studios firmly believe that people have lost the ability to think and will forgive any shoddy product as long as there 's a little girl-on-girl action .;0
2225;2226;45787;"Human Nature , in short , is n't nearly as funny as it thinks it is ; neither is it as smart .";1
2818;2821;56265;When you find yourself rooting for the monsters in a horror movie , you know the picture is in trouble .;0
2318;2319;47559;Methodical , measured , and gently tedious in its comedy , Secret Ballot is a purposefully reductive movie -- which may be why it 's so successful at lodging itself in the brain .;4
2333;2334;47864;A visionary marvel , but it 's lacking a depth in storytelling usually found in anime like this .;1
2532;2533;51436;The movie fails to portray its literarily talented and notorious subject as anything much more than a dirty old man .;0
2399;2400;49120;The usual movie rah-rah , pleasantly and predictably delivered in low-key style by director Michael Apted and writer Tom Stoppard .;3
2146;2147;44253;You do n't need to know your Ice-T 's from your Cool-J 's to realize that as far as these shootings are concerned , something is rotten in the state of California .;1
2578;2579;52215;Stuffy , full of itself , morally ambiguous and nothing to shout about .;1
2681;2683;54002;Terrific casting and solid execution give all three stories life .;3
2962;2965;58801;Despite terrific special effects and funnier gags , Harry Potter and the Chamber of Secrets finds a way to make J.K. Rowling 's marvelous series into a deadly bore .;0
2599;2600;52523;The good is very , very good ... The rest runs from mildly unimpressive to despairingly awful .;2
3127;3130;61883;Frequent flurries of creative belly laughs and genuinely enthusiastic performances ... keep the movie slaloming through its hackneyed elements with enjoyable ease .;3
3080;3083;61016;On that score , the film certainly does n't disappoint .;4
2905;2908;57689;He 's worked too hard on this movie .;2
2429;2430;49592;`` Me Without You '' is a probing examination of a female friendship set against a few dynamic decades .;2
2402;2403;49168;... what a banal bore the preachy Circuit turns out to be;0
3185;3188;62976;Hugh Grant , who has a good line in charm , has never been more charming than in About a Boy .;4
2235;2236;45960;Bogdanovich puts history in perspective and , via Kirsten Dunst 's remarkable performance , he showcases Davies as a young woman of great charm , generosity and diplomacy .;3
3030;3033;60126;While easier to sit through than most of Jaglom 's self-conscious and gratingly irritating films , it 's still tainted by cliches , painful improbability and murky points .;1
3018;3021;59874;A delightful entree in the tradition of food movies .;4
2713;2715;54592;The comedy makes social commentary more palatable .;2
2598;2599;52506;Cinematic pyrotechnics aside , the only thing Avary seems to care about are mean giggles and pulchritude .;1
2300;2301;47213;There 's surely something wrong with a comedy where the only belly laughs come from the selection of outtakes tacked onto the end credits .;0
2595;2596;52450;It 's anchored by splendid performances from an honored screen veteran and a sparkling newcomer who instantly transform themselves into a believable mother\/daughter pair .;4
2218;2219;45647;Not counting a few gross-out comedies I 've been trying to forget , this is the first film in a long time that made me want to bolt the theater in the first 10 minutes .;0
2492;2493;50681;Like Edward Norton in American History X , Ryan Gosling -LRB- Murder By Numbers -RRB- delivers a magnetic performance .;4
2833;2836;56484;Tends to plod .;1
2546;2547;51659;With so many bad romances out there , this is the kind of movie that deserves a chance to shine .;3
2497;2498;50773;A minor work yet there 's no denying the potency of Miller 's strange , fleeting brew of hopeful perseverance and hopeless closure .;2
2407;2408;49235;Cruel and inhuman cinematic punishment ... simultaneously degrades its characters , its stars and its audience .;0
2811;2814;56159;Simply a re-hash of the other seven films .;1
2928;2931;58150;Well , it 's not as pathetic as The Animal .;2
2421;2422;49476;Koury frighteningly and honestly exposes one teenager 's uncomfortable class resentment and , in turn , his self-inflicted retaliation .;3
2327;2328;47759;It 's really just another silly Hollywood action film , one among a multitude of simple-minded , yahoo-ing death shows .;2
2155;2156;44481;A uniquely sensual metaphorical dramatization of sexual obsession that spends a bit too much time on its fairly ludicrous plot .;3
3109;3112;61570;Arliss Howard 's ambitious , moving , and adventurous directorial debut , Big Bad Love , meets so many of the challenges it poses for itself that one can forgive the film its flaws .;4
2803;2806;56081;Odd and weird .;1
2812;2815;56168;Far too clever by half , Howard 's film is really a series of strung-together moments , with all the spaces in between filled with fantasies , daydreams , memories and one fantastic visual trope after another .;0
2188;2189;45074;Cho 's timing is priceless .;4
2972;2975;58975;In the long , dishonorable history of quickie teen-pop exploitation , Like Mike stands out for its only partly synthetic decency .;2
2228;2229;45823;The film boasts at least a few good ideas and features some decent performances , but the result is disappointing .;3
3154;3157;62440;The movie is virtually without context -- journalistic or historical .;0
3041;3044;60269;Soderbergh seems capable only of delivering artfully lighted , earnest inquiries that lack the kind of genuine depth that would make them redeemable .;2
2781;2784;55679;Better effects , better acting and a hilarious Kenneth Branagh .;4
3124;3127;61856;The movie weighs no more than a glass of flat champagne .;1
2998;3001;59508;a terrible adaptation of a play that only ever walked the delicate tightrope between farcical and loathsome .;0
2687;2689;54127;I never thought I 'd say this , but I 'd much rather watch teens poking their genitals into fruit pies !;1
2186;2187;45040;Like shave ice without the topping , this cinematic snow cone is as innocuous as it is flavorless .;2
3077;3080;60984;The film grows on you .;3
2169;2170;44749;Life on the rez is no picnic : this picture shows you why .;2
2846;2849;56693;Dismally dull sci-fi comedy .;0
2544;2545;51622;A very well-meaning movie , and it will stand in future years as an eloquent memorial to the World Trade Center tragedy .;3
2471;2472;50271;A glorious mess .;2
2695;2697;54268;It 's time to let your hair down -- Greek style .;2
2986;2989;59222;... post-September 11 , `` The Sum Of All Fears '' seems more tacky and reprehensible , manipulating our collective fear without bestowing the subject with the intelligence or sincerity it unequivocally deserves .;0
2242;2243;46117;Almost peerlessly unsettling .;1
2338;2339;47952;If you can get past the taboo subject matter , it will be well worth your time .;4
2593;2594;52424;The new film of Anton Chekhov 's The Cherry Orchard puts the ` ick ' in ` classic . ';1
3144;3147;62245;The directing and story are disjointed , flaws that have to be laid squarely on Taylor 's doorstep .;0
2549;2550;51709;The only way to tolerate this insipid , brutally clueless film might be with a large dose of painkillers .;0
2884;2887;57300;Obvious .;1
2254;2255;46367;As a director , Paxton is surprisingly brilliant , deftly sewing together what could have been a confusing and horrifying vision into an intense and engrossing head-trip .;4
2292;2293;47035;Daring and beautifully made .;4
2304;2305;47288;Those who are not acquainted with the author 's work , on the other hand , may fall fast asleep .;1
2510;2511;51008;The kind of movie that leaves vague impressions and a nasty aftertaste but little clear memory of its operational mechanics .;1
3128;3131;61905;It 's also not smart or barbed enough for older viewers -- not everyone thinks poo-poo jokes are ` edgy . ';0
2807;2810;56103;A potentially good comic premise and excellent cast are terribly wasted .;1
2785;2788;55736;Curiously , Super Troopers suffers because it does n't have enough vices to merit its 103-minute length .;1
2149;2150;44351;A non-Britney person might survive a screening with little harm done , except maybe for the last 15 minutes , which are as maudlin as any after-school special you can imagine .;1
2585;2586;52289;A tone of rueful compassion ... reverberates throughout this film , whose meaning and impact is sadly heightened by current world events .;3
2239;2240;46060;If The Man from Elysian Fields is doomed by its smallness , it is also elevated by it -- the kind of movie that you enjoy more because you 're one of the lucky few who sought it out .;3
2334;2335;47883;Graced with the kind of social texture and realism that would be foreign in American teen comedies .;3
3188;3191;63069;Carrying this wafer-thin movie on his nimble shoulders , Chan wades through putrid writing , direction and timing with a smile that says , ` If I stay positive , maybe I can channel one of my greatest pictures , Drunken Master . ';1
2177;2178;44899;In its understanding , often funny way , it tells a story whose restatement is validated by the changing composition of the nation .;3
2214;2215;45568;What with all the blanket statements and dime-store ruminations on vanity , the worries of the rich and sudden wisdom , the film becomes a sermon for most of its running time .;1
2207;2208;45431;The Four Feathers has rewards , from the exoticism of its seas of sand to the fierce grandeur of its sweeping battle scenes .;3
2392;2393;49010;Tiresomely derivative and hammily acted .;0
2181;2182;44976;Nothing more than a stifling morality tale dressed up in peekaboo clothing .;1
2354;2355;48246;MacDowell ... gives give a solid , anguished performance that eclipses nearly everything else she 's ever done .;4
3152;3155;62409;And neither do cliches , no matter how ` inside ' they are .;1
2168;2169;44721;With a completely predictable plot , you 'll swear that you 've seen it all before , even if you 've never come within a mile of The Longest Yard .;0
2789;2792;55826;She is a lioness , protecting her cub , and he a reluctant villain , incapable of controlling his crew .;3
2523;2524;51273;This sci-fi techno-sex thriller starts out bizarre and just keeps getting weirder .;2
3010;3013;59757;Sean Penn , you owe Nicolas Cage an apology .;2
3058;3061;60606;Incoherence reigns .;1
2345;2346;48106;I did n't smile .;1
2139;2140;44142;A return to pure Disney magic and is enjoyable family fare .;4
3150;3153;62355;Blade II is as estrogen-free as movies get , so you might want to leave your date behind for this one , or she 's gonna make you feel like you owe her big-time .;2
2564;2565;52006;Nothing short of a masterpiece -- and a challenging one .;4
2580;2581;52244;The effort is sincere and the results are honest , but the film is so bleak that it 's hardly watchable .;0
2397;2398;49089;An intelligent romantic thriller of a very old-school kind of quality .;3
2514;2515;51103;The Cat 's Meow marks a return to form for director Peter Bogdanovich ...;3
2463;2464;50153;Jones has delivered a solidly entertaining and moving family drama .;4
2566;2567;52027;A respectable but uninspired thriller that 's intelligent and considered in its details , but ultimately weak in its impact .;2
2654;2656;53553;The Sum of All Fears pretends to be a serious exploration of nuclear terrorism , but it 's really nothing more than warmed-over Cold War paranoia .;0
2150;2151;44384;Obviously , a lot of people wasted a lot of their time -LRB- including mine -RRB- on something very inconsequential .;1
2555;2556;51816;The most anti-human big studio picture since 3000 Miles to Graceland .;2
2481;2482;50464;This is a third-person story now , told by Hollywood , and much more ordinary for it .;1
2995;2998;59426;What makes the film special is the refreshingly unhibited enthusiasm that the people , in spite of clearly evident poverty and hardship , bring to their music .;3
2856;2859;56857;I can easily imagine Benigni 's Pinocchio becoming a Christmas perennial .;4
2363;2364;48405;Outside of Burger 's desire to make some kind of film , it 's really unclear why this project was undertaken;1
2263;2264;46534;The emotional overload of female angst irreparably drags the film down .;0
2624;2625;52953;A thoughtful , reverent portrait of what is essentially a subculture , with its own rules regarding love and family , governance and hierarchy .;4
2659;2661;53617;Represents the depths to which the girls-behaving-badly film has fallen .;1
2932;2935;58240;` God help us , but Capra and Cooper are rolling over in their graves . ';1
3083;3086;61088;Fessenden continues to do interesting work , and it would be nice to see what he could make with a decent budget .;3
2311;2312;47429;For this sort of thing to work , we need agile performers , but the proficient , dull Sorvino has no light touch , and Rodan is out of his league .;1
2503;2504;50879;It 's a masterpeice .;4
2567;2568;52046;One of the worst movies of the year .;0
2317;2318;47551;Initially gripping , eventually cloying POW drama .;3
2359;2360;48351;You ca n't believe anyone would really buy this stuff .;0
2592;2593;52411;With a cast of A-list Brit actors , it is worth searching out .;4
2654;2656;53553;The Sum of All Fears pretends to be a serious exploration of nuclear terrorism , but it 's really nothing more than warmed-over Cold War paranoia .;0
2692;2694;54224;The plot twists give I Am Trying to Break Your Heart an attraction it desperately needed .;3
2664;2666;53705;But it was n't .;1
3166;3169;62651;Sluggish , tonally uneven .;0
3122;3125;61828;The cast is phenomenal , especially the women .;4
2197;2198;45234;One of the very best movies ever made about the life of moviemaking .;4
2409;2410;49259;Photographed with melancholy richness and eloquently performed yet also decidedly uncinematic .;2
2277;2278;46778;A pretty funny movie , with most of the humor coming , as before , from the incongruous but chemically perfect teaming of Crystal and De Niro .;4
3137;3140;62108;The most ingenious film comedy since Being John Malkovich .;4
2303;2304;47270;Jeffs has created a breathtakingly assured and stylish work of spare dialogue and acute expressiveness .;4
2777;2780;55635;A tremendous piece of work .;4
3063;3066;60669;-LRB- T -RRB- he script is n't up to the level of the direction , nor are the uneven performances by the cast members , who seem bound and determined to duplicate Bela Lugosi 's now-cliched vampire accent .;1
2719;2721;54665;Snow Dogs finds its humour in a black man getting humiliated by a pack of dogs who are smarter than him;1
2963;2966;58833;May be more genial than ingenious , but it gets the job done .;3
2795;2798;55947;It 's Pauly Shore awful .;0
2859;2862;56885;A lot of its gags and observations reflect a woman 's point-of-view .;2
2464;2465;50162;An intriguing near-miss .;2
3162;3165;62574;In Auteil 's less dramatic but equally incisive performance , he 's a charismatic charmer likely to seduce and conquer .;3
3112;3115;61625;There is no substitute for on-screen chemistry , and when Friel pulls the strings that make Williams sink into melancholia , the reaction in Williams is as visceral as a gut punch .;4
2357;2358;48308;No , I do n't know why Steven Seagal is considered a star , nor why he keeps being cast in action films when none of them are ever any good or make any money .;1
2679;2681;53982;The gags , and the script , are a mixed bag .;1
2248;2249;46203;Though in some ways similar to Catherine Breillat 's Fat Girl , Rain is the far superior film .;4
2604;2605;52596;Adam Sandler 's Eight Crazy Nights grows on you -- like a rash .;0
2584;2585;52282;... a lesson in prehistoric hilarity .;2
2794;2797;55933;`` Secretary '' is owned by its costars , Spader and Gyllenhaal .;2
2628;2630;53035;But darned if it does n't also keep us riveted to our seats .;4
3071;3074;60888;A compelling motion picture that illustrates an American tragedy .;4
2619;2620;52848;Fairy-tale formula , serves as a paper skeleton for some very good acting , dialogue , comedy , direction and especially charm .;4
2265;2266;46565;-LRB- Woo 's -RRB- most resonant film since The Killer .;3
2619;2620;52848;Fairy-tale formula , serves as a paper skeleton for some very good acting , dialogue , comedy , direction and especially charm .;4
2325;2326;47734;A triumph of pure craft and passionate heart .;4
3110;3113;61599;But , no , we get another scene , and then another .;2
3137;3140;62108;The most ingenious film comedy since Being John Malkovich .;4
2445;2446;49860;What 's missing in Murder by Numbers is any real psychological grounding for the teens ' deviant behaviour .;0
2522;2523;51252;The weird thing about The Santa Clause 2 , purportedly a children 's movie , is that there is nothing in it to engage children emotionally .;1
2701;2703;54390;Half Past Dead is just such an achievement .;4
3073;3076;60906;Much like its easily dismissive take on the upscale lifestyle , there is n't much there here .;0
2808;2811;56114;In any case , I would recommend Big Bad Love only to Winger fans who have missed her since 1995 's Forget Paris .;1
2889;2892;57361;It 's as if a bored Cage spent the duration of the film 's shooting schedule waiting to scream : `` Got AIDS yet ? '';0
2573;2574;52145;Nicholson 's understated performance is wonderful .;4
2329;2330;47800;Deliberately and skillfully uses ambiguity to suggest possibilities which imbue the theme with added depth and resonance .;3
2520;2521;51213;Based on Dave Barry 's popular book of the same name , the movie benefits from having a real writer plot out all of the characters ' moves and overlapping story .;3
2478;2479;50415;Victor Rosa is Leguizamo 's best movie work so far , a subtle and richly internalized performance .;4
2613;2614;52775;This starts off with a 1950 's Doris Day feel and it gets very ugly , very fast .;1
2925;2928;58100;-LRB- While The Last Metro -RRB- was more melodramatic , confined to a single theater company and its strategies and deceptions , while Tavernier is more concerned with the entire period of history .;3
2210;2211;45473;Unfunny and lacking any sense of commitment to or affection for its characters , the Reginald Hudlin comedy relies on toilet humor , ethnic slurs .;0
2175;2176;44846;Like coming into a long-running , well-written television series where you 've missed the first half-dozen episodes and probably wo n't see the next six .;1
2830;2833;56433;Whether this is art imitating life or life imitating art , it 's an unhappy situation all around .;1
2677;2679;53949;Miller has crafted an intriguing story of maternal instincts and misguided acts of affection .;3
2771;2774;55546;Why sit through a crummy , wannabe-hip crime comedy that refers incessantly to old movies , when you could just rent those movies instead , let alone seek out a respectable new one ?;0
2707;2709;54507;You 'll find yourself wishing that you and they were in another movie .;0
2432;2433;49643;A peculiar misfire that even Tunney ca n't save .;0
2434;2435;49661;The film has a childlike quality about it .;2
2890;2893;57386;4Ever has the same sledgehammer appeal as Pokemon videos , but it breathes more on the big screen and induces headaches more slowly .;3
2486;2487;50559;This Chicago has hugely imaginative and successful casting to its great credit , as well as one terrific score and attitude to spare .;4
2938;2941;58344;As pure over-the-top trash , any John Waters movie has it beat by a country mile .;0
2570;2571;52063;This English-language version ... does full honor to Miyazaki 's teeming and often unsettling landscape , and to the conflicted complexity of his characters .;2
2403;2404;49179;It would be disingenuous to call Reno a great film , but you can say that about most of the flicks moving in and out of the multiplex .;2
2256;2257;46404;Stanley Kwan has directed not only one of the best gay love stories ever made , but one of the best love stories of any stripe .;4
2752;2755;55258;At once subtle and visceral , the film never succumbs to the trap of the maudlin or tearful , offering instead with its unflinching gaze a measure of faith in the future .;4
3124;3127;61856;The movie weighs no more than a glass of flat champagne .;1
2211;2212;45499;Rich in shadowy metaphor and as sharp as a samurai sword , Jiang Wen 's Devils on the Doorstep is a wartime farce in the alternately comic and gut-wrenching style of Joseph Heller or Kurt Vonnegut .;4
3158;3161;62478;How many more times will indie filmmakers subject us to boring , self-important stories of how horrible we are to ourselves and each other ?;1
2852;2855;56794;Who needs mind-bending drugs when they can see this , the final part of the ` qatsi ' trilogy , directed by Godfrey Reggio , with music by Philip Glass ?;3
2650;2652;53488;Ourside the theatre Roger might be intolerable company , but inside it he 's well worth spending some time with .;4
2923;2926;58070;Fulfills the minimum requirement of Disney animation .;2
2555;2556;51816;The most anti-human big studio picture since 3000 Miles to Graceland .;2
3067;3070;60790;This harrowing journey into combat hell vividly captures the chaotic insanity and personal tragedies that are all too abundant when human hatred spews forth unchecked .;2
2957;2960;58688;Until it goes off the rails in its final 10 or 15 minutes , Wendigo , Larry Fessenden 's spooky new thriller , is a refreshingly smart and newfangled variation on several themes derived from far less sophisticated and knowing horror films .;3
2800;2803;56043;Overall , interesting as a documentary -- but not very Imaxy .;2
2851;2854;56779;The most opaque , self-indulgent and just plain goofy an excuse for a movie as you can imagine .;1
3171;3174;62760;entertaining enough , but nothing new;1
2370;2371;48516;Cineasts will revel in those visual in-jokes , as in the film 's verbal pokes at everything from the likes of Miramax chief Harvey Weinstein 's bluff personal style to the stylistic rigors of Denmark 's Dogma movement .;3
2458;2459;50070;A wild ride of a movie that keeps throwing fastballs .;3
3160;3163;62538;An awkward hybrid of genres that just does n't work .;1
2870;2873;57050;Pure cinematic intoxication , a wildly inventive mixture of comedy and melodrama , tastelessness and swooning elegance .;3
2956;2959;58685;Earnest but heavy-handed .;2
2354;2355;48246;MacDowell ... gives give a solid , anguished performance that eclipses nearly everything else she 's ever done .;4
2723;2725;54728;But tongue-in-cheek preposterousness has always been part of For the most part Wilde 's droll whimsy helps `` Being Earnest '' overcome its weaknesses and Parker 's creative interference ...;3
3070;3073;60874;A refreshing change from the usual whoopee-cushion effort aimed at the youth market .;4
2753;2756;55289;He watches them as they float within the seas of their personalities .;3
2673;2675;53887;My Wife Is an Actress works as well as it does because -LRB- the leads -RRB- are such a companionable couple .;3
3088;3091;61164;... a gleefully grungy , hilariously wicked black comedy ...;4
2921;2924;58011;The film is enriched by an imaginatively mixed cast of antic spirits , headed by Christopher Plummer as the subtlest and most complexly evil Uncle Ralph I 've ever seen in the many film and stage adaptations of the work .;4
2844;2847;56655;... the picture 's cleverness is ironically muted by the very people who are intended to make it shine .;2
3076;3079;60968;For a film that celebrates radical , nonconformist values , What to Do in Case of Fire ?;2
3043;3046;60316;Co-writer\/director Jonathan Parker 's attempts to fashion a Brazil-like , hyper-real satire fall dreadfully short .;0
3181;3184;62925;Has all the complexity and realistic human behavior of an episode of General Hospital .;1
2521;2522;51242;Despite some charm and heart , this quirky soccer import is forgettable;1
3000;3003;59544;A hypnotic cyber hymn and a cruel story of youth culture .;3
2913;2916;57866;a wonderfully warm human drama that remains vividly in memory long after viewing;3
3117;3120;61723;The movie is so resolutely cobbled together out of older movies that it even uses a totally unnecessary prologue , just because it seems obligatory .;0
2947;2950;58544;The film does give a pretty good overall picture of the situation in Laramie following the murder of Matthew Shepard .;3
2952;2955;58639;The movie slides downhill as soon as macho action conventions assert themselves .;0
3069;3072;60842;That rare documentary that incorporates so much of human experience -- drama , conflict , tears and surprise -- that it transcends the normal divisions between fiction and nonfiction film .;4
2372;2373;48597;You have enough finely tuned acting to compensate for the movie 's failings .;2
2501;2502;50860;Is truth stranger than fiction ?;2
2782;2785;55691;A derivative collection of horror and sci-fi cliches .;0
3084;3087;61110;Elegant , mannered and teasing .;3
3133;3136;62004;The path Ice Age follows most closely , though , is the one established by Warner Bros. giant Chuck Jones , who died a matter of weeks before the movie 's release .;2
2528;2529;51353;This strenuously unfunny Showtime deserves the hook .;0
