;SentenceId;PhraseId;Phrase;Sentiment
4265;447;10567;The directive to protect the code at all costs also begins to blur as the importance of the man and the code merge;2
4266;3263;64441;This is a picture that Maik , the firebrand turned savvy ad man , would be envious of : it hijacks the heat of revolution and turns it into a sales tool .;2
4267;4486;86622;delightfully rendered;4
4268;554;12903;Parts;2
4269;152;4004;"There 's a scientific law to be discerned here that producers would be well to heed : Mediocre movies start to drag as soon as the action speeds up ; when the explosions start , they fall to pieces .";0
4270;357;8594;They 're going through the motions , but the zip is gone .;2
4271;5936;111838;It 's mindless junk like this that makes you appreciate original romantic comedies like Punch-Drunk Love .;2
4272;7964;146412;It 's as if Allen , at 66 , has stopped challenging himself .;1
4273;2178;44899;In its understanding , often funny way , it tells a story whose restatement is validated by the changing composition of the nation .;3
4274;7567;139476;A fascinating documentary that provides a rounded and revealing overview of this ancient holistic healing system;4
4275;5690;107647;In painting an unabashedly romantic picture of a nation whose songs spring directly from the lives of the people , the movie exalts the Marxian dream of honest working folk , with little to show for their labor , living harmoniously , joined in song .;3
4276;7017;130273;Does point the way for adventurous Indian filmmakers toward a crossover into nonethnic markets .;3
4277;6055;113892;Forget the Psychology 101 study of romantic obsession and just watch the procession of costumes in castles and this wo n't seem like such a bore .;1
4278;2586;52289;A tone of rueful compassion ... reverberates throughout this film , whose meaning and impact is sadly heightened by current world events .;3
4279;4281;82922;Self-congratulatory , misguided , and ill-informed , if nonetheless compulsively watchable .;2
4280;5575;105577;The journey to the secret 's eventual discovery is a separate adventure , and thrill enough .;3
4281;4675;89831;Kids should have a stirring time at this beautifully drawn movie .;4
4282;129;3471;A brilliant gag at the expense of those who paid for it and those who pay to see it .;2
4283;1924;40165;Far more enjoyable than its predecessor .;4
4284;3649;71526;The Importance of Being Earnest movie seems to be missing a great deal of the acerbic repartee of the play . '';1
4285;890;20056;Everything its title implies , a standard-issue crime drama spat out from the Tinseltown assembly line .;2
4286;1644;34935;A zinger-filled crowd-pleaser that open-minded Elvis fans -LRB- but by no means all -RRB- will have fun with .;4
4287;460;10822;"The young stars are too cute ; the story and ensuing complications are too manipulative ; the message is too blatant ; the resolutions are too convenient .";1
4288;2372;48562;An uneven look into a grim future that does n't come close to the level of intelligence and visual splendour that can be seen in other films based on Philip K. Dick stories .;1
4289;5216;99479;that works .;3
4290;6625;123389;This movie has a strong message about never giving up on a loved one , but it 's not an easy movie to watch and will probably disturb many who see it .;2
4291;8300;152119;The fourth `` Pokemon '' is a diverting -- if predictable -- adventure suitable for a matinee , with a message that cautions children about disturbing the world 's delicate ecological balance .;3
4292;1122;24635;`` -LRB- Hopkins -RRB- does n't so much phone in his performance as fax it .;1
4293;6575;122573;What 's really sad is to see two Academy Award winning actresses -LRB- and one Academy Award winning actor -RRB- succumb to appearing in this junk that 's TV sitcom material at best .;1
4294;7044;130753;Leaks treacle from every pore .;1
4295;3090;61138;It 's a boring movie about a boring man , made watchable by a bravura performance from a consummate actor incapable of being boring .;3
4296;8083;148544;Sheridan had a wonderful account to work from , but , curiously , he waters it down , turning grit and vulnerability into light reading .;1
4297;7800;143711;It follows the Blair Witch formula for an hour , in which we 're told something creepy and vague is in the works , and then it goes awry in the final 30 minutes .;1
4298;3804;74253;Other than a mildly engaging central romance , Hospital is sickly entertainment at best and mind-destroying cinematic pollution at worst .;0
4299;5593;105941;A sham construct based on theory , sleight-of-hand , and ill-wrought hypothesis .;1
4300;676;15743;Light the candles , bring out the cake and do n't fret about the calories because there 's precious little substance in Birthday Girl -- it 's simply , and surprisingly , a nice , light treat .;4
4301;1869;39170;About half of them are funny , a few are sexy and none are useful in telling the story , which is paper-thin and decidedly unoriginal .;1
4302;7162;132823;There 's a delightfully quirky movie to be made from curling , but Brooms is n't it .;1
4303;1603;34117;The screenplay , co-written by director Imogen Kimmel , lacks the wit necessary to fully exploit the comic elements of the premise , making the proceedings more bizarre than actually amusing .;1
4304;5272;100481;Mr. Wollter and Ms. Seldhal give strong and convincing performances , but neither reaches into the deepest recesses of the character to unearth the quaking essence of passion , grief and fear .;1
4305;1828;38382;The movie 's major and most devastating flaw is its reliance on formula , though , and it 's quite enough to lessen the overall impact the movie could have had .;1
4306;2076;42978;Although Barbershop boasts some of today 's hottest and hippest acts from the world of television , music and stand-up comedy , this movie strangely enough has the outdated swagger of a shameless ` 70s blaxploitation shuck-and-jive sitcom .;2
4307;1640;34834;Like its title character , this Nicholas Nickleby finds itself in reduced circumstances -- and , also like its hero , it remains brightly optimistic , coming through in the end .;3
4308;3851;75106;Just the sort of lazy tearjerker that gives movies about ordinary folk a bad name .;1
4309;4906;94028;cynical and serious look at teenage boys doing what they do best - being teenagers .;2
4310;5451;103377;The actors improvise and scream their way around this movie directionless , lacking any of the rollicking dark humor so necessary to make this kind of idea work on screen .;0
4311;2885;57254;Starts as an intense political and psychological thriller but is sabotaged by ticking time bombs and other Hollywood-action cliches .;0
4312;541;12587;A sugar-coated Rocky whose valuable messages are forgotten 10 minutes after the last trombone honks .;1
4313;845;19247;The Bai brothers have taken an small slice of history and opened it up for all of us to understand , and they 've told a nice little story in the process .;4
4314;7598;140025;Most folks with a real stake in the American sexual landscape will find it either moderately amusing or just plain irrelevant .;2
4315;2467;50195;... del Toro maintains a dark mood that makes the film seem like something to endure instead of enjoy .;1
4316;114;3022;Whenever it threatens to get bogged down in earnest dramaturgy , a stirring visual sequence like a surge through swirling rapids or a leap from pinnacle to pinnacle rouses us .;3
4317;3338;65817;Giggling at the absurdities and inconsistencies is part of the fun .;3
4318;2764;55377;Is Red Dragon worthy of a place alongside the other Hannibal movies ?;2
4319;3131;61905;It 's also not smart or barbed enough for older viewers -- not everyone thinks poo-poo jokes are ` edgy . ';0
4320;6549;122174;Only masochistic moviegoers need apply .;1
4321;6262;117365;That 's not vintage Spielberg and that , finally , is minimally satisfying .;2
4322;3216;63529;There is no denying the power of Polanski 's film ...;3
4323;6632;123504;less on forced air;2
4324;1854;38845;"That the real Antwone Fisher was able to overcome his personal obstacles and become a good man is a wonderful thing ; that he has been able to share his story so compellingly with us is a minor miracle .";4
4325;4759;91471;The story is virtually impossible to follow here , but there 's a certain style and wit to the dialogue .;2
4326;8305;152219;He 's not good with people .;1
4327;2285;46879;On the surface a silly comedy , Scotland , PA would be forgettable if it were n't such a clever adaptation of the bard 's tragic play .;3
4328;6518;121609;The corpse count ultimately overrides what little we learn along the way about vicarious redemption .;1
4329;165;4337;Before it takes a sudden turn and devolves into a bizarre sort of romantic comedy , Steven Shainberg 's adaptation of Mary Gaitskill 's harrowing short story ... is a brilliantly played , deeply unsettling experience .;3
4330;7402;136857;I believe Silberling had the best intentions here , but he just does n't have the restraint to fully realize them .;2
4331;3327;65649;Peralta 's mythmaking could have used some informed , adult hindsight .;2
4332;6726;125150;It would be churlish to begrudge anyone for receiving whatever consolation that can be found in Dragonfly , yet it is impossible to find the film anything but appalling , shamelessly manipulative and contrived , and totally lacking in conviction .;0
4333;1765;37205;But it would be better to wait for the video .;1
4334;2160;44593;Naipaul fans may be disappointed .;1
4335;6853;127409;Mastering its formidable arithmetic of cameras and souls , Group articulates a flood of emotion .;3
4336;4136;80235;It 's a shame that the storyline and its underlying themes ... finally seem so impersonal or even shallow .;0
4337;1571;33490;To Blandly Go Where We Went 8 Movies Ago ...;1
4338;7426;137265;An undistinguished attempt to make a classic theater piece cinematic .;0
4339;2967;58846;is a mess .;0
4340;1857;38933;Those unfamiliar with Mormon traditions may find The Singles Ward occasionally bewildering .;2
4341;6423;120081;It 's a wise and powerful tale of race and culture forcefully told , with superb performances throughout .;4
4342;1573;33527;Vividly demonstrates that the director of such Hollywood blockbusters as Patriot Games can still turn out a small , personal film with an emotional wallop .;4
4343;962;21482;Horrid little propaganda film with fascinating connections not only to the Serbs themselves but also to a network of American right-wing extremists .;3
4344;6131;115081;Coppola 's directorial debut is an incredibly layered and stylistic film that , despite a fairly slow paced , almost humdrum approach to character development , still manages at least a decent attempt at meaningful cinema .;3
4345;8307;152245;It 's not a classic spy-action or buddy movie , but it 's entertaining enough and worth a look .;2
4346;5953;112134;Philosophically , intellectually and logistically a mess .;0
4347;1686;35736;It is up to you to decide if you need to see it .;2
4348;6037;113556;The casting of von Sydow ... is itself Intacto 's luckiest stroke .;3
4349;3746;73317;A picture as erratic as its central character .;2
4350;3788;74043;Time Out is existential drama without any of the pretension associated with the term .;3
4351;3235;63924;Abderrahmane Sissako 's Heremakono -LRB- Waiting for Happiness -RRB- is an elegiac portrait of a transit city on the West African coast struggling against foreign influences .;2
4352;268;6701;An uplifting , largely bogus story .;2
4353;3618;70951;` Stock up on silver bullets for director Neil Marshall 's intense freight train of a film . ';3
4354;2562;51911;While Hollywood Ending has its share of belly laughs -LRB- including a knockout of a closing line -RRB- , the movie winds up feeling like a great missed opportunity .;1
4355;5922;111601;It 's depressing to see how far Herzog has fallen .;1
4356;2730;54812;... while certainly clever in spots , this too-long , spoofy update of Shakespeare 's Macbeth does n't sustain a high enough level of invention .;1
4357;600;13931;The early and middle passages are surprising in how much they engage and even touch us .;4
4358;1169;25571;Sparkling , often hilarious romantic jealousy comedy ... Attal looks so much like a young Robert DeNiro that it seems the film should instead be called ` My Husband Is Travis Bickle ' .;4
4359;6544;122102;That Jack Nicholson makes this man so watchable is a tribute not only to his craft , but to his legend .;4
4360;1997;41501;A lot smarter than your average Bond .;3
4361;2434;49652;Coppola has made a film of intoxicating atmosphere and little else .;3
4362;5987;112739;There 's not a single jump-in-your-seat moment and believe it or not , Jason actually takes a backseat in his own film to special effects .;0
4363;8006;147104;The great pity is that those responsible did n't cut their losses -- and ours -- and retitle it The Adventures of Direct-to-Video Nash , and send it to its proper home .;1
4364;3541;69638;An enjoyable feel-good family comedy regardless of race .;3
4365;2793;55851;It 's a film that 's destined to win a wide summer audience through word-of-mouth reviews and , not far down the line , to find a place among the studio 's animated classics .;3
4366;4407;85225;Highlighted by a gritty style and an excellent cast , it 's better than one might expect when you look at the list of movies starring Ice-T in a major role .;3
4367;3184;62925;Has all the complexity and realistic human behavior of an episode of General Hospital .;1
4368;4739;91089;It gives devastating testimony to both people 's capacity for evil and their heroic capacity for good .;3
4369;769;17746;Hugely accomplished slice of Hitchcockian suspense .;3
4370;3032;60095;Certainly the big finish was n't something Galinsky and Hawley could have planned for ... but part of being a good documentarian is being there when the rope snaps .;3
4371;921;20633;The lousy John Q all but spits out Denzel Washington 's fine performance in the title role .;1
4372;2801;55997;The high-concept scenario soon proves preposterous , the acting is robotically italicized , and truth-in-advertising hounds take note : There 's very little hustling on view .;1
4373;5844;110337;A good-natured ensemble comedy that tries hard to make the most of a bumper cast , but never quite gets off the ground .;1
4374;673;15680;Delivers roughly equal amounts of beautiful movement and inside information .;3
4375;2806;56081;Odd and weird .;1
4376;3187;62974;A small gem from Belgium .;4
4377;3312;65398;Handsome and sophisticated approach to the workplace romantic comedy .;3
4378;5079;97137;Nicks refuses to let Slackers be seen as just another teen movie , which means he can be forgiven for frequently pandering to fans of the gross-out comedy .;3
4379;7967;146459;While the filmmaking may be a bit disjointed , the subject matter is so fascinating that you wo n't care .;3
4380;1971;41117;One suspects that Craven endorses They simply because this movie makes his own look much better by comparison .;1
4381;5466;103647;Eight Legged Freaks falls flat as a spoof .;1
4382;4580;88176;A dopey movie clothed in excess layers of hipness .;2
4383;1793;37701;It 's a day at the beach -- with air conditioning and popcorn .;3
4384;4229;81963;It 's easy to love Robin Tunney -- she 's pretty and she can act -- but it gets harder and harder to understand her choices .;1
4385;1482;31626;But it does somehow manage to get you under its spell .;3
4386;1777;37414;Brainless , but enjoyably over-the-top , the retro gang melodrama , Deuces Wild represents fifties teen-gang machismo in a way that borders on rough-trade homo-eroticism .;1
4387;6569;122483;Real Women Have Curves does n't offer any easy answers .;2
4388;4338;83950;Diane Lane 's sophisticated performance ca n't rescue Adrian Lyne 's Unfaithful from its sleazy moralizing .;1
4389;5116;97713;Maybe LeBlanc thought , `` Hey , the movie about the baseball-playing monkey was worse . '';1
4390;5892;111148;You might say Tykwer has done all that Heaven allows , if you wanted to make as anti-Kieslowski a pun as possible .;2
4391;7305;135270;The quirky and recessive charms of co-stars Martin Donovan and Mary-Louise Parker help overcome the problematic script .;3
4392;3756;73488;Silly , loud and goofy .;2
4393;6989;129827;The movie 's messages are quite admirable , but;2
4394;7472;138120;Every visual joke is milked , every set-up obvious and lengthy , every punchline predictable .;1
4395;6634;123544;Strictly a ` guy 's film ' in the worst sense of the expression .;1
4396;6312;118155;To show these characters in the act and give them no feelings of remorse -- and to cut repeatedly to the flashback of the original rape -- is overkill to the highest degree .;2
4397;2681;53982;The gags , and the script , are a mixed bag .;1
4398;6790;126311;By turns gripping , amusing , tender and heart-wrenching , Laissez-passer has all the earmarks of French cinema at its best .;3
4399;51;1369;Takes a clunky TV-movie approach to detailing a chapter in the life of the celebrated Irish playwright , poet and drinker .;1
4400;5934;111795;Blood Work is laughable in the solemnity with which it tries to pump life into overworked elements from Eastwood 's Dirty Harry period .;1
4401;7745;142702;Morvern rocks .;4
4402;4959;95084;No amount of good acting is enough to save Oleander 's uninspired story .;1
4403;2831;56425;Fairly run-of-the-mill .;1
4404;7354;136105;A conventional but heartwarming tale .;4
4405;3211;63456;The campy results make Mel Brooks ' Borscht Belt schtick look sophisticated .;3
4406;7880;145063;Diaz wears out her welcome in her most charmless performance;0
4407;3886;75794;A selection of scenes in search of a movie .;1
4408;7346;135987;I 'm left slightly disappointed that it did n't .;1
4409;7235;134043;The film never gets over its own investment in conventional arrangements , in terms of love , age , gender , race , and class .;1
4410;4637;89225;Road to Perdition does display greatness , and it 's worth seeing .;4
4411;2712;54553;She allows each character to confront their problems openly and honestly .;3
4412;3091;61164;... a gleefully grungy , hilariously wicked black comedy ...;4
4413;71;1918;But it has an ambition to say something about its subjects , but not a willingness .;1
4414;134;3591;It 's hard to say who might enjoy this , are there Tolstoy groupies out there ?;1
4415;3829;74680;Count on his movie to work at the back of your neck long after you leave the theater .;2
4416;6370;119174;While this one gets off with a good natured warning , future Lizard endeavors will need to adhere more closely to the laws of laughter;1
4417;1631;34690;It 's not the worst comedy of the year , but it certainly wo n't win any honors .;2
4418;8422;154151;The acting is n't much better .;0
4419;3743;73266;A cheap scam put together by some cynical creeps at Revolution Studios and Imagine Entertainment to make the suckers out there surrender $ 9 and 93 minutes of unrecoverable life .;0
4420;3520;69261;There 's a sheer unbridled delight in the way the story unfurls ...;3
4421;782;17948;A cartoon ?;1
4422;195;4991;Though the film never veers from its comic course , its unintentional parallels might inadvertently evoke memories and emotions which are anything but humorous .;2
4423;1819;38230;You just know something terrible is going to happen .;2
4424;4814;92447;Sa da TAY !;2
4425;7747;142732;In old-fashioned screenwriting parlance , Ms. Shreve 's novel proved too difficult a text to ` lick , ' despite the efforts of a first-rate cast .;1
4426;1084;23851;Millions of dollars heaped upon a project of such vast proportions need to reap more rewards than spiffy bluescreen technique and stylish weaponry .;1
4427;629;14585;Although the subject matter may still be too close to recent national events , the film works - mostly due to its superior cast of characters .;3
4428;3521;69272;Igby Goes Down is one of those movies .;2
4429;7831;144268;A gripping drama .;4
4430;5111;97654;Aan opportunity wasted .;1
4431;4372;84493;If you like blood , guts and crazy beasts stalking men with guns though ... you will likely enjoy this monster .;3
4432;7414;137061;A wannabe comedy of manners about a brainy prep-school kid with a Mrs. Robinson complex founders on its own preciousness -- and squanders its beautiful women .;1
4433;6787;126253;If legendary shlockmeister Ed Wood had ever made a movie about a vampire , it probably would look a lot like this alarming production , adapted from Anne Rice 's novel The Vampire Chronicles .;2
4434;39;1051;Do n't judge this one too soon - it 's a dark , gritty story but it takes off in totally unexpected directions and keeps on going .;3
4435;533;12440;This one is strictly a lightweight escapist film .;2
4436;6487;121132;However , it 's pleasant enough and its ecological , pro-wildlife sentiments are certainly welcome .;3
4437;1329;28697;It 's fun , but it 's a real howler .;3
4438;1673;35521;This follow-up seems so similar to the 1953 Disney classic that it makes one long for a geriatric Peter .;2
4439;857;19530;A cleverly crafted but ultimately hollow mockumentary .;1
4440;3610;70805;Maggie Smith as the Ya-Ya member with the O2-tank will absolutely crack you up with her crass , then gasp for gas , verbal deportment .;4
4441;7910;145510;Sex With Strangers will shock many with its unblinking frankness .;2
4442;1518;32384;A really good premise is frittered away in middle-of-the-road blandness .;1
4443;3185;62938;Eight Legged Freaks is clever and funny , is amused by its special effects , and leaves you feeling like you 've seen a movie instead of an endless trailer .;3
4444;2496;50735;As relationships shift , director Robert J. Siegel allows the characters to inhabit their world without cleaving to a narrative arc .;3
4445;6960;129445;Director Oliver Parker labors so hard to whip life into The Importance of Being Earnest that he probably pulled a muscle or two .;2
4446;8420;154118;Alarms for Duvall 's throbbing sincerity and his elderly propensity for patting people while he talks .;3
4447;1303;28277;I 'm going to give it a marginal thumbs up .;3
4448;3468;68341;A journey that is as difficult for the audience to take as it is for the protagonist -- yet it 's potentially just as rewarding .;3
4449;8352;152981;The party scenes deliver some tawdry kicks .;2
4450;2090;43254;Spider-Man is about growing strange hairs , getting a more mature body , and finding it necessary to hide new secretions from the parental units .;1
4451;6472;120916;Though Lan Yu lacks a sense of dramatic urgency , the film makes up for it with a pleasing verisimilitude .;3
4452;5447;103288;Its use of the thriller form to examine the labyrinthine ways in which people 's lives cross and change , buffeted by events seemingly out of their control , is intriguing , provocative stuff .;4
4453;985;21972;modeled;2
4454;7585;139786;But on the whole , you 're gonna like this movie .;3
4455;934;20918;The umpteenth summer skinny dip in Jerry Bruckheimer 's putrid pond of retread action twaddle .;2
4456;6519;121625;At every opportunity to do something clever , the film goes right over the edge and kills every sense of believability ... all you have left is a no-surprise series of explosions and violence while Banderas looks like he 's not trying to laugh at how bad it;1
4457;433;10284;A serviceable Euro-trash action extravaganza , with a decent sense of humor and plenty of things that go boom -- handguns , BMWs and seaside chateaus .;2
4458;6567;122459;Rubbo 's humorously tendentious intervention into the who-wrote-Shakespeare controversy .;3
4459;235;5877;Thoughtless , random , superficial humour and a lot of very bad Scouse accents;0
4460;2856;56827;True Hollywood Story .;2
4461;2607;52643;A complex psychological drama about a father who returns to his son 's home after decades away .;3
4462;5026;96203;It 's so downbeat and nearly humorless that it becomes a chore to sit through -- despite some first-rate performances by its lead .;1
4463;3706;72540;Thoroughly enjoyable .;3
4464;8028;147520;While the film is competent , it 's also uninspired , lacking the real talent and wit to elevate it beyond its formula to the level of classic romantic comedy to which it aspires .;1
4465;3920;76316;One of the film 's most effective aspects is its Tchaikovsky soundtrack of neurasthenic regret .;2
4466;7465;137977;for those for whom the name Woody Allen was once a guarantee of something fresh , sometimes funny , and usually genuinely worthwhile , Hollywood Ending is a depressing experience;0
4467;4456;86069;both overstuffed and undernourished ... The film ca n't be called a solid success , although there 's plenty of evidence here to indicate Clooney might have better luck next time .;2
4468;7052;130865;Remember it .;3
4469;1232;26844;Blisteringly rude , scarily funny , sorrowfully sympathetic to the damage it surveys , the film has in Kieran Culkin a pitch-perfect Holden .;4
4470;6923;128705;Ryan Gosling ... is at 22 a powerful young actor .;4
4471;156;4124;In the director 's cut , the film is not only a love song to the movies but it also is more fully an example of the kind of lush , all-enveloping movie experience it rhapsodizes .;3
4472;1374;29646;The filmmakers try to balance pointed , often incisive satire and unabashed sweetness , with results that are sometimes bracing , sometimes baffling and quite often , and in unexpected ways , touching .;3
4473;6674;124269;Though her fans will assuredly have their funny bones tickled , others will find their humor-seeking dollars best spent elsewhere .;1
4474;1589;33799;Alain Choquart 's camera barely stops moving , portraying both the turmoil of the time and giving Conduct a perpetual sense of urgency , which , for a film that takes nearly three hours to unspool , is both funny and irritating .;2
4475;6004;113061;Offers laughs and insight into one of the toughest ages a kid can go through .;3
