;SentenceId;PhraseId;Phrase;Sentiment
4476;1653;35158;It would be great to see this turd squashed under a truck , preferably a semi .;0
4477;6660;124052;A romance ?;2
4478;5622;106439;It 's one thing to read about or rail against the ongoing - and unprecedented - construction project going on over our heads .;1
4479;3114;61611;Seagal ran out of movies years ago , and this is just the proof .;0
4480;6379;119325;is an inexpressible and drab wannabe looking for that exact niche .;1
4481;4023;78181;It 's clotted with heavy-handed symbolism , dime-store psychology and endless scenic shots that make 105 minutes seem twice as long .;0
4482;4377;84598;It 's so badly made on every level that I 'm actually having a hard time believing people were paid to make it .;0
4483;5523;104577;If Mr. Zhang 's subject matter is , to some degree at least , quintessentially American , his approach to storytelling might be called Iranian .;2
4484;4466;86239;Suffers from a lack of clarity and audacity that a subject as monstrous and pathetic as Dahmer demands .;0
4485;2595;52444;The movie is well crafted , and well executed .;4
4486;1464;31315;Insomnia does not become one of those rare remakes to eclipse the original , but it does n't disgrace it , either .;2
4487;3296;65145;A bracing , unblinking work that serves as a painful elegy and sobering cautionary tale .;3
4488;5275;100532;Hollywood Ending just is n't very funny .;1
4489;7322;135561;Worse than ` Silence of the Lambs ' better than ` Hannibal ';2
4490;691;16062;A film that will probably please people already fascinated by Behan but leave everyone else yawning with admiration .;2
4491;7842;144420;But how it washed out despite all of that is the project 's prime mystery .;1
4492;7163;132838;The animation is competent , and some of the gags are quite funny , but Jonah ... never shakes the oppressive , morally superior good-for-you quality that almost automatically accompanies didactic entertainment .;2
4493;2820;56242;This is one of those rare docs that paints a grand picture of an era and makes the journey feel like a party .;3
4494;7478;138188;Ryan Gosling is , in a word , brilliant as the conflicted Daniel .;4
4495;6425;120121;As they used to say in the 1950s sci-fi movies , Signs is a tribute to Shyamalan 's gifts , which are such that we 'll keep watching the skies for his next project .;3
4496;5314;101108;can be as tiresome as 9 seconds of Jesse Helms ' anti- Castro rhetoric , which are included;1
4497;4419;85437;For his first attempt at film noir , Spielberg presents a fascinating but flawed look at the near future .;3
4498;6865;127620;Even if you do n't understand what on earth is going on , this is a movie that will stimulate hours of post viewing discussion , if only to be reminded of who did what to whom and why .;3
4499;2907;57657;Over the years , Hollywood has crafted a solid formula for successful animated movies , and Ice Age only improves on it , with terrific computer graphics , inventive action sequences and a droll sense of humor .;4
4500;3144;62178;-LRB- Fiji diver Rusi Vulakoro and the married couple Howard and Michelle Hall -RRB- show us the world they love and make us love it , too .;4
4501;5851;110448;It may be about drug dealers , kidnapping , and unsavory folks , but the tone and pacing are shockingly intimate .;2
4502;854;19481;A somewhat disappointing and meandering saga .;2
4503;4429;85649;Whatever one makes of its political edge , this is beautiful filmmaking from one of French cinema 's master craftsmen .;4
4504;1309;28353;The premise of Jason X is silly but strangely believable .;3
4505;8023;147441;Harry Potter and the Chamber of Secrets is deja vu all over again , and while that is a cliche , nothing could be more appropriate .;2
4506;6802;126486;A loud , ugly , irritating movie without any of its satirical salvos hitting a discernible target .;0
4507;7873;144974;It 's that painful .;0
4508;3041;60235;It 's not just a feel-good movie , it 's a feel movie .;3
4509;8112;149078;Vera has created a provocative , absorbing drama that reveals the curse of a self-hatred instilled by rigid social mores .;3
4510;1396;30057;The movie does its best to work us over , with second helpings of love , romance , tragedy , false dawns , real dawns , comic relief , two separate crises during marriage ceremonies , and the lush scenery of the Cotswolds .;3
4511;5504;104318;Michael Moore has perfected the art of highly entertaining , self-aggrandizing , politically motivated documentary-making , and he 's got as potent a topic as ever here .;3
4512;3528;69392;Caine makes us watch as his character awakens to the notion that to be human is eventually to have to choose .;3
4513;8323;152534;Merci pour le movie .;2
4514;3784;73982;I encourage young and old alike to go see this unique and entertaining twist on the classic whale 's tale -- you wo n't be sorry !;4
4515;7187;133213;Visually breathtaking , viscerally exciting , and dramatically moving , it 's the very definition of epic adventure .;4
4516;7548;139249;Surprisingly powerful and universal .;4
4517;1835;38505;Intriguing and stylish .;4
4518;1805;37946;She 's as rude and profane as ever , always hilarious and , most of the time , absolutely right in her stinging social observations .;4
4519;2605;52596;Adam Sandler 's Eight Crazy Nights grows on you -- like a rash .;0
4520;5747;108593;Overall , it 's a pretty mediocre family film .;2
4521;1152;25183;Would be an unendurable viewing experience for this ultra-provincial New Yorker if 26-year-old Reese Witherspoon were not on hand to inject her pure fantasy character , Melanie Carmichael , with a massive infusion of old-fashioned Hollywood magic .;3
4522;8279;151727;Shot largely in small rooms , the film has a gentle , unforced intimacy that never becomes claustrophobic .;4
4523;6522;121708;Little more than a stylish exercise in revisionism whose point ... is no doubt true , but serves as a rather thin moral to such a knowing fable .;1
4524;4960;95096;No amount of nostalgia for Carvey 's glory days can disguise the fact that the new film is a lame kiddie flick and that Carvey 's considerable talents are wasted in it .;0
4525;7056;130906;Mushes the college-friends genre -LRB- The Big Chill -RRB- together with the contrivances and overwrought emotion of soap operas .;2
4526;2526;51299;The origin story is well told , and the characters will not disappoint anyone who values the original comic books .;2
4527;7845;144498;More successful at relating history than in creating an emotionally complex , dramatically satisfying heroine;1
4528;119;3151;The filmmakers want nothing else than to show us a good time , and in their cheap , B movie way , they succeed .;3
4529;1185;25869;A live-wire film that never loses its ability to shock and amaze .;4
4530;6909;128417;The film is so busy making reference to other films and trying to be other films that it fails to have a heart , mind or humor of its own .;0
4531;7952;146243;A chilly , remote , emotionally distant piece ... so dull that its tagline should be : ` In space , no one can hear you snore . ';0
4532;6166;115698;Turturro is fabulously funny and over the top as a ` very sneaky ' butler who excels in the art of impossible disappearing\/reappearing acts;4
4533;7841;144418;It sucked .;0
4534;5154;98337;Eric Byler 's nuanced pic avoids easy sentiments and explanations ...;2
4535;7024;130385;Visually engrossing , seldom hammy , honorably Mexican and burns its Kahlories with conviction .;3
4536;4058;78845;The dramatic scenes are frequently unintentionally funny , and the action sequences -- clearly the main event -- are surprisingly uninvolving .;1
4537;6610;123150;This director 's cut -- which adds 51 minutes -- takes a great film and turns it into a mundane soap opera .;1
4538;4364;84384;Each scene immediately succumbs to gravity and plummets to earth .;0
4539;2952;58578;It 's a documentary that says that the alternate sexuality meant to set you free may require so much relationship maintenance that celibacy can start looking good .;2
4540;3853;75140;Together writer-director Danny Verete 's three tales comprise a powerful and reasonably fulfilling gestalt .;3
4541;1665;35413;It is a movie about passion .;2
4542;8088;148667;The best thing about the movie is its personable , amusing cast .;3
4543;463;10872;A wry , affectionate delight .;4
4544;4467;86257;It has the air of a surprisingly juvenile lark , a pop-influenced prank whose charms are immediately apparent and wear thin with repetition .;1
4545;5952;112115;Jacquot has filmed the opera exactly as the libretto directs , ideally capturing the opera 's drama and lyricism .;3
4546;6078;114280;, Skins has its heart in the right place;2
4547;6119;114899;The story that emerges has elements of romance , tragedy and even silent-movie comedy .;3
4548;5473;103816;Splendidly illustrates the ability of the human spirit to overcome adversity .;3
4549;7116;132013;Gosling creates a staggeringly compelling character , a young man whose sharp intellect is at the very root of his contradictory , self-hating , self-destructive ways .;4
4550;2738;54959;Zellweger 's whiny pouty-lipped poof faced and spindly attempt at playing an ingenue makes her nomination as best actress even more of a an a;1
4551;5855;110502;A dashing and absorbing outing with one of France 's most inventive directors .;3
4552;8199;150469;The logic of it all will be Greek to anyone not predisposed to the movie 's rude and crude humor .;0
4553;2998;59426;What makes the film special is the refreshingly unhibited enthusiasm that the people , in spite of clearly evident poverty and hardship , bring to their music .;3
4554;158;4185;Eerily accurate depiction of depression .;1
4555;923;20669;Satin Rouge is not a new , or inventive , journey , but it 's encouraging to see a three-dimensional , average , middle-aged woman 's experience of self-discovery handled with such sensitivity .;3
4556;3322;65577;They were right .;2
4557;5282;100613;Too damn weird to pass up , and for the blacklight crowd , way cheaper -LRB- and better -RRB- than Pink Floyd tickets .;3
4558;4063;78970;The script is high on squaddie banter , low on shocks .;3
4559;2206;45382;A delightful little film that revels in its own simplicity , Mostly Martha will leave you with a smile on your face and a grumble in your stomach .;3
4560;7559;139403;The movie is gorgeously made , but it is also somewhat shallow and art-conscious .;2
4561;1990;41393;I liked About Schmidt a lot , but I have a feeling that I would have liked it much more if Harry & Tonto never existed .;3
4562;3103;61391;Shows moments of promise but ultimately succumbs to cliches and pat storytelling .;1
4563;5122;97828;It reduces the complexities to bromides and slogans and it gets so preachy-keen and so tub-thumpingly loud it makes you feel like a chump just for sitting through it .;1
4564;2402;49155;A diverse and astonishingly articulate cast of Palestinian and Israeli children .;3
4565;7799;143695;Its appeal will probably limited to LDS Church members and undemanding armchair tourists .;1
4566;4551;87642;There is a welcome lack of pretension about the film , which very simply sets out to entertain and ends up delivering in good measure .;4
4567;2944;58424;I hate the feeling of having been slimed in the name of High Art .;0
4568;7006;130081;The trashy teen-sleaze equivalent of Showgirls .;1
4569;4340;83997;Even with Harris 's strong effort , the script gives him little to effectively probe Lear 's soul-stripping breakdown .;2
4570;1059;23343;The new Insomnia is a surprisingly faithful remake of its chilly predecessor , and when it does elect to head off in its own direction , it employs changes that fit it well rather than ones that were imposed for the sake of commercial sensibilities .;3
4571;4516;87074;Wishy-washy .;1
4572;3899;75975;A little better than Sorcerer 's Stone .;3
4573;4439;85794;Ferrara 's strongest and most touching movie of recent years .;4
4574;191;4912;The dragons are the real stars of Reign of Fire and you wo n't be disappointed .;3
4575;4614;88815;A movie that the less charitable might describe as a castrated cross between Highlander and Lolita .;1
4576;6944;129128;It all starts to smack of a Hallmark Hall of Fame , with a few four letter words thrown in that are generally not heard on television .;1
4577;243;6077;At a time when commercialism has squeezed the life out of whatever idealism American moviemaking ever had , Godfrey Reggio 's career shines like a lonely beacon .;3
4578;5805;109559;An artful yet depressing film that makes a melodramatic mountain out of the molehill of a missing bike .;1
4579;6599;122956;You can tell almost immediately that Welcome to Collinwood is n't going to jell .;1
4580;5143;98155;I like this movie a lot .;4
4581;5942;111945;The explosion essentially ruined -- or , rather , overpowered -- the fiction of the movie for me .;1
4582;4556;87747;There 's real visual charge to the filmmaking , and a strong erotic spark to the most crucial lip-reading sequence .;3
4583;3226;63703;High Crimes carries almost no organic intrigue as a government \/ Marine\/legal mystery , and that 's because the movie serves up all of that stuff , nearly subliminally , as the old-hat province of male intrigue .;1
4584;6760;125825;A strangely stirring experience that finds warmth in the coldest environment and makes each crumb of emotional comfort feel like a 10-course banquet .;4
4585;8450;154555;This method almost never fails him , and it works superbly here .;4
4586;1810;38049;-LRB- Shyamalan -RRB- turns the goose-pimple genre on its empty head and fills it with spirit , purpose and emotionally bruised characters who add up to more than body count .;3
4587;3349;66007;... the cast portrays their cartoon counterparts well ... but quite frankly , Scoob and Shag do n't eat enough during the film . ';1
4588;3303;65254;They kept much of the plot but jettisoned the stuff that would make this a moving experience for people who have n't read the book .;1
4589;938;20985;The whole affair is as predictable as can be .;2
4590;1691;35833;Offers a clear-eyed chronicle of a female friendship that is more complex and honest than anything represented in a Hollywood film .;4
4591;5852;110470;Laggard drama wending its way to an uninspired philosophical epiphany .;1
4592;6936;128981;I 'm guessing the director is a magician .;3
4593;1897;39720;A puppy dog so desperate for attention it nearly breaks its little neck trying to perform entertaining tricks .;1
4594;2278;46778;A pretty funny movie , with most of the humor coming , as before , from the incongruous but chemically perfect teaming of Crystal and De Niro .;4
4595;2545;51622;A very well-meaning movie , and it will stand in future years as an eloquent memorial to the World Trade Center tragedy .;3
4596;523;12228;Highly recommended as an engrossing story about a horrifying historical event and the elements which contributed to it .;3
4597;2635;53124;An unexpectedly sweet story of sisterhood .;3
4598;6492;121241;... Watching it was painful .;1
4599;5535;104813;Pretend it 's a werewolf itself by avoiding eye contact and walking slowly away .;1
4600;3142;62135;An engrossing portrait of uncompromising artists trying to create something original against the backdrop of a corporate music industry that only seems to care about the bottom line .;3
4601;7658;141187;For the most part , the film does hold up pretty well .;3
4602;826;18800;A remarkably alluring film set in the constrictive Eisenhower era about one suburban woman 's yearning in the face of a loss that shatters her cheery and tranquil suburban life .;3
4603;6173;115840;Who knows , but it works under the direction of Kevin Reynolds .;3
4604;1763;37178;Murder by Numbers ' is n't a great movie , but it 's a perfectly acceptable widget .;2
4605;6129;115051;Frida is n't that much different from many a Hollywood romance .;1
4606;998;22224;I admire it and yet can not recommend it , because it overstays its natural running time .;1
4607;1313;28397;What a dumb , fun , curiously adolescent movie this is .;3
4608;6879;127880;Of all the Halloween 's , this is the most visually unappealing .;0
4609;3436;67651;Whether or not you 're enlightened by any of Derrida 's lectures on `` the other '' and `` the self , '' Derrida is an undeniably fascinating and playful fellow .;4
4610;3868;75433;No matter how firmly director John Stainton has his tongue in his cheek , the fact remains that a wacky concept does not a movie make .;2
4611;1852;38827;Two hours of sepia-tinted heavy metal images and surround sound effects of people moaning .;2
4612;3385;66694;Unspeakable , of course , barely begins to describe the plot and its complications .;0
4613;1362;29400;Formuliac , but fun .;3
4614;4826;92626;A big-budget\/all-star movie as unblinkingly pure as The Hours is a distinct rarity , and an event .;3
4615;7066;131114;A harrowing account of a psychological breakdown .;3
4616;4849;93064;It 's hard to imagine acting that could be any flatter .;0
4617;2216;45600;Breen 's script is sketchy with actorish notations on the margin of acting .;1
4618;5684;107556;Although the film boils down to a lightweight story about matchmaking , the characters make Italian for Beginners worth the journey;3
4619;6160;115584;The people in ABC Africa are treated as docile , mostly wordless ethnographic extras .;2
4620;2032;42200;Nachtwey clears the cynicism right out of you .;2
4621;5060;96833;An involving , inspirational drama that sometimes falls prey to its sob-story trappings .;2
4622;3222;63645;It 's a very tasteful rock and roll movie .;3
4623;3005;59581;Often lingers just as long on the irrelevant as on the engaging , which gradually turns What Time Is It There ?;1
4624;996;22208;I have not been this disappointed by a movie in a long time .;0
4625;7630;140616;By no means a slam-dunk and sure to ultimately disappoint the action fans who will be moved to the edge of their seats by the dynamic first act , it still comes off as a touching , transcendent love story .;1
4626;7695;141843;The film 's best trick is the way that it treats conspiracy as a kind of political Blair Witch , a monstrous murk that haunts us precisely because it can never be seen .;2
4627;5756;108752;In other words , it 's just another sports drama\/character study .;1
4628;6905;128337;The Hanukkah spirit seems fried in pork .;1
4629;3781;73934;Gay or straight , Kissing Jessica Stein is one of the greatest date movies in years .;4
4630;4903;93958;The things this movie tries to get the audience to buy just wo n't fly with most intelligent viewers .;1
4631;8295;152018;The dirty jokes provide the funniest moments in this oddly sweet comedy about jokester highway patrolmen .;3
4632;6317;118243;Do we really need another film that praises female self-sacrifice ?;1
4633;6267;117440;This mistaken-identity picture is so film-culture referential that the final product is a ghost .;1
4634;4601;88560;Both a successful adaptation and an enjoyable film in its own right .;4
4635;4460;86164;Worth seeing just for Weaver and LaPaglia .;3
4636;4379;84624;Sewer rats could watch this movie and be so skeeved out that they 'd need a shower .;0
4637;1446;31028;Entirely suspenseful , extremely well-paced and ultimately ... dare I say , entertaining !;4
4638;2974;58966;Munch 's screenplay is tenderly observant of his characters .;3
4639;4193;81346;-LRB- Breheny 's -RRB- lensing of the New Zealand and Cook Island locations captures both the beauty of the land and the people .;4
4640;1730;36581;Or for the year , for that matter .;2
4641;2928;58100;-LRB- While The Last Metro -RRB- was more melodramatic , confined to a single theater company and its strategies and deceptions , while Tavernier is more concerned with the entire period of history .;3
4642;7418;137141;Trailer park Magnolia : too long , too cutesy , too sure of its own importance , and possessed of that peculiar tension of being too dense & about nothing at all .;2
4643;1529;32604;The Chateau belongs to Rudd , whose portrait of a therapy-dependent flakeball spouting French malapropisms ... is a nonstop hoot .;3
4644;992;22116;The film exudes the urbane sweetness that Woody Allen seems to have bitterly forsaken .;3
4645;6185;116036;A hallmark film in an increasingly important film industry and worth the look .;3
4646;5346;101590;-LRB- A -RRB- devastatingly powerful and astonishingly vivid Holocaust drama .;4
4647;2960;58688;Until it goes off the rails in its final 10 or 15 minutes , Wendigo , Larry Fessenden 's spooky new thriller , is a refreshingly smart and newfangled variation on several themes derived from far less sophisticated and knowing horror films .;3
4648;4548;87591;Another useless recycling of a brutal mid - '70s American sports movie .;1
4649;6882;127915;As if trying to grab a lump of Play-Doh , the harder that Liman tries to squeeze his story , the more details slip out between his fingers .;1
4650;722;16718;Ms. Hutchins is talented enough and charismatic enough to make us care about Zelda 's ultimate fate .;4
4651;6498;121332;"Each scene wreaks of routine ; the film never manages to generate a single threat of suspense .";2
4652;7385;136597;Like Schindler 's List , The Grey Zone attempts to be grandiloquent , but ends up merely pretentious -- in a grisly sort of way .;1
4653;6626;123416;The characters are never more than sketches ... which leaves any true emotional connection or identification frustratingly out of reach .;0
4654;3548;69769;Ian Holm conquers France as an earthy Napoleon;3
4655;199;5097;This is a superior horror flick .;4
4656;8216;150726;I have to admit I walked out of Runteldat .;0
4657;3628;71100;Smart and alert , Thirteen Conversations About One Thing is a small gem .;3
4658;7943;146074;But the talented cast alone will keep you watching , as will the fight scenes .;4
4659;5104;97575;Are monsters born , or made ?;2
4660;7018;130287;A direct-to-void release , heading nowhere .;2
4661;2902;57521;-LRB- Fincher 's -RRB- camera sense and assured pacing make it an above-average thriller .;3
4662;6381;119349;The film sparkles with the the wisdom and humor of its subjects .;4
4663;8277;151708;A pathetically inane and unimaginative cross between XXX and Vertical Limit .;1
4664;7948;146156;Two tedious acts light on great scares and a good surprise ending .;3
4665;2360;48351;You ca n't believe anyone would really buy this stuff .;0
4666;4399;85037;By turns touching , raucously amusing , uncomfortable , and , yes , even sexy , Never Again is a welcome and heartwarming addition to the romantic comedy genre .;4
4667;5870;110804;-LRB- A -RRB- poorly executed comedy .;0
4668;470;11009;Brings awareness to an issue often overlooked -- women 's depression .;2
4669;5382;102265;Much of this slick and sprightly CGI feature is sufficiently funny to amuse even the most resolutely unreligious parents who escort their little ones to megaplex screenings .;3
4670;5237;99800;Nicole Holofcener 's Lovely and Amazing , from her own screenplay , jumps to the head of the class of women 's films that manage to avoid the ghetto of sentimental chick-flicks by treating female follies with a satirical style .;4
4671;7997;146932;The movie , while beautiful , feels labored , with a hint of the writing exercise about it .;2
4672;2307;47318;But it could be , by its art and heart , a necessary one .;3
4673;212;5337;"Parents beware ; this is downright movie penance .";1
4674;5296;100815;Holland lets things peter out midway , but it 's notably better acted -- and far less crass - than some other recent efforts in the burgeoning genre of films about black urban professionals .;3
4675;4667;89672;Any film that does n't even in passing mention political prisoners , poverty and the boat loads of people who try to escape the country is less a documentary and more propaganda by way of a valentine sealed with a kiss .;1
4676;6766;125944;Like its title character , Esther Kahn is unusual but unfortunately also irritating .;1
4677;7126;132169;The characters seem one-dimensional , and the film is superficial and will probably be of interest primarily to its target audience .;1
4678;6329;118450;A powerful and telling story that examines forbidden love , racial tension , and other issues that are as valid today as they were in the 1950s .;4
4679;1368;29515;This is the kind of movie that you only need to watch for about thirty seconds before you say to yourself , ` Ah , yes , here we have a bad , bad , bad movie . ';0
4680;5631;106618;The pleasures that it does afford may be enough to keep many moviegoers occupied amidst some of the more serious-minded concerns of other year-end movies .;3
4681;4024;78204;The characters are interesting and the relationship between Yosuke and Saeko is worth watching as it develops , but there 's not enough to the story to fill two hours .;2
4682;3369;66404;It 's a feel-good movie about which you can actually feel good .;4
4683;504;11663;A rock-solid gangster movie with a fair amount of suspense , intriguing characters and bizarre bank robberies , plus a heavy dose of father-and-son dynamics .;3
4684;7875;144988;Highly watchable stuff .;4
4685;1633;34726;One of the funnier movies in town .;4
4686;5895;111204;This is one of the year 's best films .;4
4687;5741;108490;`` What really happened ? '';2
4688;7649;141018;What saves it ... and makes it one of the better video-game-based flicks , is that the film acknowledges upfront that the plot makes no sense , such that the lack of linearity is the point of emotional and moral departure for protagonist Alice .;3
4689;8089;148675;Inherently caustic and oddly whimsical , the film chimes in on the grieving process and strangely draws the audience into the unexplainable pain and eccentricities that are attached to the concept of loss .;3
4690;5110;97639;The misery of these people becomes just another voyeuristic spectacle , to be consumed and forgotten .;0
