;SentenceId;PhraseId;Phrase;Sentiment
212;3727;72970;It 's the perfect star vehicle for Grant , allowing him to finally move away from his usual bumbling , tongue-tied screen persona .;3
213;4775;91761;So-so entertainment .;2
214;1688;35770;`` Bad '' is the operative word for `` Bad Company , '' and I do n't mean that in a good way .;0
215;8017;147333;At a time when we 've learned the hard way just how complex international terrorism is , Collateral Damage paints an absurdly simplistic picture .;1
216;3461;68176;The fact that it is n't very good is almost beside the point .;1
217;5474;103827;The filmmakers know how to please the eye , but it is not always the prettiest pictures that tell the best story .;3
218;1141;25015;The documentary is much too conventional -- lots of boring talking heads , etc. -- to do the subject matter justice .;0
219;6902;128289;As simple and innocent a movie as you can imagine .;3
220;3345;65945;A dark-as-pitch comedy that frequently veers into corny sentimentality , probably would not improve much after a therapeutic zap of shock treatment .;1
221;7487;138314;Not kids , who do n't need the lesson in repugnance .;2
222;6952;129276;Its juxtaposition of overwrought existentialism and stomach-churning gore will have you forever on the verge of either cracking up or throwing up .;2
223;4742;91160;Meyjes ' provocative film might be called an example of the haphazardness of evil .;3
224;1316;28450;A well made indieflick in need of some trims and a more chemistry between its stars .;3
225;2060;42668;Just as the lousy Tarantino imitations have subsided , here comes the first lousy Guy Ritchie imitation .;1
226;2351;48195;But Windtalkers does n't beat that one , either .;1
227;5338;101505;It offers a glimpse of the Solomonic decision facing Jewish parents in those turbulent times : to save their children and yet to lose them .;3
228;3430;67578;Those 24-and-unders looking for their own Caddyshack to adopt as a generational signpost may have to keep on looking .;1
229;1034;22837;Highly uneven and inconsistent ... Margarita Happy Hour kinda resembles the el cheapo margaritas served within .;0
230;801;18349;Gives an intriguing twist to the French coming-of-age genre .;3
231;4405;85160;If you 're over 25 , have an IQ over 90 , and have a driver 's license , you should be able to find better entertainment .;0
232;3964;77055;Friday After Next is a lot more bluster than bite .;1
233;4813;92421;Let 's face it -- there are n't many reasons anyone would want to see Crossroads if they 're not big fans of teen pop kitten Britney Spears .;2
234;2630;53035;But darned if it does n't also keep us riveted to our seats .;4
235;116;3087;But when it does , you 're entirely unprepared .;2
236;6711;124881;Affleck merely creates an outline for a role he still needs to grow into , a role that Ford effortlessly filled with authority .;2
237;7832;144270;Darkly funny and frequently insightful .;4
238;7259;134550;As saccharine movies go , this is likely to cause massive cardiac arrest if taken in large doses .;1
239;993;22135;The script is a dim-witted pairing of teen-speak and animal gibberish .;1
240;5643;106844;An older cad instructs a younger lad in Zen and the art of getting laid in this prickly indie comedy of manners and misanthropy .;3
241;2464;50153;Jones has delivered a solidly entertaining and moving family drama .;4
242;4424;85544;Like blended shades of lipstick , these components combine into one terrific story with lots of laughs .;4
243;3848;75035;Scherfig 's light-hearted profile of emotional desperation is achingly honest and delightfully cheeky .;4
244;3495;68813;Close enough in spirit to its freewheeling trash-cinema roots to be a breath of fresh air .;3
245;6310;118118;Undoubtedly the scariest movie ever made about tattoos .;3
246;2731;54840;There 's an epic here , but you have to put it together yourself .;2
247;3065;60665;more precious than perspicacious;3
248;5355;101711;Although it starts off so bad that you feel like running out screaming , it eventually works its way up to merely bad rather than painfully awful .;1
249;6604;123057;Remarkable for its intelligence and intensity .;4
250;7030;130460;Its inescapable absurdities are tantamount to insulting the intelligence of anyone who has n't been living under a rock -LRB- since Sept. 11 -RRB- .;1
251;2012;41779;For 95 often hilarious minutes;3
252;4650;89441;You could easily mistake it for a sketchy work-in-progress that was inexplicably rushed to the megaplexes before its time .;0
253;7886;145146;This big screen caper has a good bark , far from being a bow-wow .;2
254;6976;129700;Ah , what the hell .;2
255;6410;119829;You 'll feel like you ate a Reeses without the peanut butter ... ';1
256;7863;144836;The movie is a mess from start to finish .;1
257;7691;141766;The more you think about the movie , the more you will probably like it .;3
258;1361;29387;Could n't someone take Rob Schneider and have him switch bodies with a funny person ?;1
259;5931;111751;-LRB- Grant -RRB- goes beyond his usual fluttering and stammering and captures the soul of a man in pain who gradually comes to recognize it and deal with it .;3
260;343;8275;It labours as storytelling .;1
261;1616;34414;A loud , brash and mainly unfunny high school comedy .;0
262;8429;154258;A very charming and funny movie .;4
263;1735;36641;You can watch , giggle and get an adrenaline boost without feeling like you 've completely lowered your entertainment standards .;3
264;2953;58606;For those in search of something different , Wendigo is a genuinely bone-chilling tale .;3
265;3534;69528;Helps to remind the First World that HIV\/AIDS is far from being yesterday 's news .;2
266;3672;71914;And the positive change in tone here seems to have recharged him .;3
267;4462;86184;But mainstream audiences will find little of interest in this film , which is often preachy and poorly acted .;1
268;6104;114702;There are some movies that hit you from the first scene and you know it 's going to be a trip .;3
269;6154;115505;A solid cast , assured direction and complete lack of modern day irony .;3
270;5661;107138;An interesting psychological game of cat-and-mouse , three-dimensional characters and believable performances all add up to a satisfying crime drama .;4
271;6325;118397;His scenes are short and often unexpected .;2
272;6928;128803;A haunting tale of murder and mayhem .;3
273;1237;26940;A seriocomic debut of extravagant promise by Georgian-Israeli director Dover Kosashvili .;3
274;4512;87029;A few zingers aside , the writing is indifferent , and Jordan Brady 's direction is prosaic .;1
275;4048;78646;... feels as if -LRB- there 's -RRB- a choke leash around your neck so director Nick Cassavetes can give it a good , hard yank whenever he wants you to feel something .;0
276;5350;101638;I 'm sorry to say that this should seal the deal - Arnold is not , nor will he be , back .;1
277;382;9149;Just a bunch of good actors flailing around in a caper that 's neither original nor terribly funny .;0
278;7309;135341;Apart from its own considerable achievement;3
279;2995;59386;Slow , silly and unintentionally hilarious .;2
280;3374;66465;McTiernan 's remake may be lighter on its feet -- the sober-minded original was as graceful as a tap-dancing rhino -- but it is just as boring and as obvious .;1
281;3858;75206;I could have used my two hours better watching Being John Malkovich again .;1
282;8076;148420;Goes a long way on hedonistic gusto .;2
283;3960;76981;It 's a fine , old-fashioned-movie movie , which is to say it 's unburdened by pretensions to great artistic significance .;3
284;7518;138732;Filled with Alexandre Desplat 's haunting and sublime music , the movie completely transfixes the audience .;4
285;4840;92919;A pretty decent kid-pleasing , tolerable-to-adults lark of a movie .;3
286;1942;40558;Adaptation 's success in engaging the audience in the travails of creating a screenplay is extraordinary .;4
287;481;11171;This film is too busy hitting all of its assigned marks to take on any life of its own .;1
288;974;21776;It makes sense that he went back to school to check out the girls -- his film is a frat boy 's idea of a good time .;2
289;2697;54268;It 's time to let your hair down -- Greek style .;2
290;4660;89591;Wiseman is patient and uncompromising , letting his camera observe and record the lives of women torn apart by a legacy of abuse .;3
291;1951;40712;Astonishing is n't the word -- neither is incompetent , incoherent or just plain crap .;0
292;1293;28133;After the setup , the air leaks out of the movie , flattening its momentum with about an hour to go .;2
293;3432;67610;What a great way to spend 4 units of your day .;3
294;5614;106328;It is n't quite one of the worst movies of the year .;0
295;3966;77091;Such master screenwriting comes courtesy of John Pogue , the Yale grad who previously gave us `` The Skulls '' and last year 's `` Rollerball . '';4
296;3198;63237;A jaw-droppingly beautiful work;4
297;599;13912;Falsehoods pile up , undermining the movie 's reality and stifling its creator 's comic voice .;1
298;3317;65485;The movie 's ultimate point -- that everyone should be themselves -- is trite , but the screenwriter and director Michel Gondry restate it to the point of ridiculousness .;0
299;3066;60669;-LRB- T -RRB- he script is n't up to the level of the direction , nor are the uneven performances by the cast members , who seem bound and determined to duplicate Bela Lugosi 's now-cliched vampire accent .;1
300;3825;74591;A fresh , entertaining comedy that looks at relationships minus traditional gender roles .;4
301;1804;37925;"Those prone to indignation need not apply ; those susceptible to blue hilarity , step right up .";3
302;321;7883;So original in its base concept that you can not help but get caught up .;4
303;1252;27200;` Linklater fans , or pretentious types who want to appear avant-garde will suck up to this project ... ';1
304;1268;27603;Aspires to the cracked lunacy of The Adventures of Buckaroo Banzai , but thanks to an astonishingly witless script ends up more like The Adventures of Ford Fairlane .;1
305;6746;125562;Time literally stops on a dime in the tries-so-hard-to-be-cool `` Clockstoppers , '' but that does n't mean it still wo n't feel like the longest 90 minutes of your movie-going life .;0
306;5241;99888;Although the sequel has all the outward elements of the original , the first film 's lovely flakiness is gone , replaced by the forced funniness found in the dullest kiddie flicks .;0
307;5162;98476;Nijinsky says , ' I know how to suffer ' and if you see this film you 'll know too .;1
308;1300;28238;This is cruel , misanthropic stuff with only weak claims to surrealism and black comedy .;1
309;4237;82110;Pure of intention and passably diverting , His Secret Life is light , innocuous and unremarkable .;2
310;164;4319;You bet there is and it 's what makes this rather convoluted journey worth taking .;2
311;5995;112881;Handsome and sincere but slightly awkward in its combination of entertainment and evangelical boosterism .;2
312;3328;65663;Meyjes 's movie , like Max Rothman 's future , does not work .;1
313;7269;134679;A thriller without thrills and a mystery devoid of urgent questions .;1
314;6321;118316;If Deuces Wild had been tweaked up a notch it would have become a camp adventure , one of those movies that 's so bad it starts to become good .;2
315;6184;116024;It just does n't have much else ... especially in a moral sense .;2
316;3764;73606;And educational !;3
317;7869;144904;Even during the climactic hourlong cricket match , boredom never takes hold .;3
318;7806;143825;Baran is shockingly devoid of your typical Majid Majidi shoe-loving , crippled children .;1
319;6834;127076;A bit too eager to please .;1
320;8542;156022;-LRB- Tries -RRB- to parody a genre that 's already a joke in the United States .;1
321;2024;42046;An energetic and engaging film that never pretends to be something it is n't .;3
322;3344;65926;It 's an odd show , pregnant with moods , stillborn except as a harsh conceptual exercise .;1
323;4591;88370;Steers refreshingly clear of the usual cliches .;3
324;3042;60247;The sound of GUNFIRE and cell phones RINGING .;2
325;6536;121944;Two-bit potboiler .;1
326;1349;29142;"This is a movie filled with unlikable , spiteful idiots ; whether or not their friendship is salvaged makes no difference in the least .";0
327;2561;51900;Unfortunately , that 's precisely what Arthur Dong 's Family Fundamentals does .;1
328;6857;127475;Cantet beautifully illuminates what it means sometimes to be inside looking out , and at other times outside looking in .;3
329;4012;77961;These are textbook lives of quiet desperation .;1
330;4529;87309;At the end , when the now computerized Yoda finally reveals his martial artistry , the film ascends to a kinetic life so teeming that even cranky adults may rediscover the quivering kid inside .;3
331;50;1333;Bloody Sunday has the grace to call for prevention rather than to place blame , making it one of the best war movies ever made .;4
332;2025;42061;An enormously entertaining movie , like nothing we 've ever seen before , and yet completely familiar .;4
333;2971;58891;Never lets go your emotions , taking them to surprising highs , sorrowful lows and hidden impulsive niches ... gorgeous , passionate , and at times uncommonly moving .;3
334;2262;46514;A beautifully shot but dull and ankle-deep ` epic . ';1
335;7443;137578;Sad to say -- it accurately reflects the rage and alienation that fuels the self-destructiveness of many young people .;3
336;6340;118629;A bright , inventive , thoroughly winning flight of revisionist fancy .;3
337;3523;69283;Sandra Bullock , despite downplaying her good looks , carries a little too much ai n't - she-cute baggage into her lead role as a troubled and determined homicide cop to quite pull off the heavy stuff .;1
338;6532;121890;Strictly middle of the road .;2
339;170;4495;Campanella gets the tone just right -- funny in the middle of sad in the middle of hopeful .;3
340;5103;97566;Otherwise , this could be a passable date film .;1
341;6377;119305;It 's a tour de force , written and directed so quietly that it 's implosion rather than explosion you fear .;2
342;702;16256;The film is ... determined to treat its characters , weak and strong , as fallible human beings , not caricatures , and to carefully delineate the cost of the inevitable conflicts between human urges and an institution concerned with self-preservation .;3
343;6442;120476;... in no way original , or even all that memorable , but as downtown Saturday matinee brain candy , it does n't disappoint .;3
344;4680;89930;` Unfaithful ' cheats on itself and retreats to comfortable territory .;1
345;9;248;But it does n't leave you with much .;1
346;8094;148768;Fred Schepisi 's tale of four Englishmen facing the prospect of their own mortality views youthful affluence not as a lost ideal but a starting point .;3
347;4226;81898;Even when Crush departs from the 4W formula ... it feels like a glossy rehash .;1
348;3356;66189;The work of an artist tormented by his heritage , using his storytelling ability to honor the many faceless victims .;3
349;1384;29864;A lot like the imaginary sport it projects onto the screen -- loud , violent and mindless .;1
350;6135;115179;It is just too bad the film 's story does not live up to its style .;1
351;2333;47858;Even at its worst , it 's not half-bad .;3
352;6566;122448;It 's surprisingly decent , particularly for a tenth installment in a series .;3
353;3780;73923;There are a few modest laughs , but certainly no thrills .;2
354;8438;154377;A wonderfully speculative character study that made up for its rather slow beginning by drawing me into the picture .;3
355;6088;114446;The truth about Charlie is that it 's a brazenly misguided project .;1
356;1198;26133;Me no lika da accents so good , but I thoroughly enjoyed the love story .;3
357;7005;130066;Reyes ' directorial debut has good things to offer , but ultimately it 's undone by a sloppy script;1
358;741;17086;New Yorkers always seem to find the oddest places to dwell ...;2
359;7666;141327;-LRB- Hell is -RRB- looking down at your watch and realizing Serving Sara is n't even halfway through .;0
360;8227;150930;Two badly interlocked stories drowned by all too clever complexity .;1
361;8415;154019;The whole mildly pleasant outing -- the R rating is for brief nudity and a grisly corpse -- remains aloft not on its own self-referential hot air , but on the inspired performance of Tim Allen .;2
362;128;3417;Keenly observed and refreshingly natural , Swimming gets the details right , from its promenade of barely clad bodies in Myrtle Beach , S.C. , to the adrenaline jolt of a sudden lunch rush at the diner .;3
363;4631;89073;Plays like one of those conversations that Comic Book Guy on `` The Simpsons '' has .;1
364;3106;61450;Enticing and often funny documentary .;4
365;1255;27300;LaBute ca n't avoid a fatal mistake in the modern era : He 's changed the male academic from a lower-class Brit to an American , a choice that upsets the novel 's exquisite balance and shreds the fabric of the film .;2
366;6269;117469;It 's kind of sad that so many people put so much time and energy into this turkey .;1
367;3119;61708;No cliche escapes the perfervid treatment of gang warfare called ces Wild .;1
368;5924;111613;The film has an infectious enthusiasm and we 're touched by the film 's conviction that all life centered on that place , that time and that sport .;3
369;2795;55911;As it stands it 's an opera movie for the buffs .;2
370;5073;97058;The camera twirls !;2
371;475;11104;An extremely unpleasant film .;0
372;333;8090;A non-mystery mystery .;1
373;2937;58264;Begins like a docu-drama but builds its multi-character story with a flourish .;4
374;3245;64133;With or without ballast tanks , K-19 sinks to a Harrison Ford low .;1
375;6851;127380;Mention `` Solaris '' five years from now and I 'm sure those who saw it will have an opinion to share .;3
376;7685;141662;Manages to be both hugely entertaining and uplifting .;4
377;1957;40847;Busy urban comedy is clearly not Zhang 's forte , his directorial touch is neither light nor magical enough to bring off this kind of whimsy .;1
378;1636;34782;An elegant film;2
379;8228;150940;- I also wanted a little alien as a friend !;3
380;7039;130641;The gags that fly at such a furiously funny pace that the only rip off that we were aware of was the one we felt when the movie ended so damned soon .;4
381;3389;66783;But the problem with Wendigo , for all its effective moments , is n't really one of resources .;1
382;4531;87352;Lacks the inspiration of the original and has a bloated plot that stretches the running time about 10 minutes past a child 's interest and an adult 's patience .;0
383;6274;117557;The film makes strong arguments regarding the social status of America 's indigenous people , but really only exists to try to eke out an emotional tug of the heart , one which it fails to get .;2
384;4275;82758;Stripped almost entirely of such tools as nudity , profanity and violence , LaBute does manage to make a few points about modern man and his problematic quest for human connection .;1
385;4242;82195;While Bollywood\/Hollywood will undoubtedly provide its keenest pleasures to those familiar with Bombay musicals , it also has plenty for those -LRB- like me -RRB- who are n't .;3
386;2664;53653;Although sensitive to a fault , it 's often overwritten , with a surfeit of weighty revelations , flowery dialogue , and nostalgia for the past and roads not taken .;1
387;4622;88948;Try Hell House , which documents the cautionary Christian spook-a-rama of the same name .;2
388;3469;68360;A mature , deeply felt fantasy of a director 's travel through 300 years of Russian history .;3
389;3169;62651;Sluggish , tonally uneven .;0
390;5229;99678;Interesting both as a historical study and as a tragic love story .;3
391;2343;48030;Any Chekhov is better than no Chekhov , but it would be a shame if this was your introduction to one of the greatest plays of the last 100 years .;2
392;3533;69501;Better still , he does all of this , and more , while remaining one of the most savagely hilarious social critics this side of Jonathan Swift .;4
393;7554;139322;A touching drama about old age and grief with a tour de force performance by Michel Piccoli .;4
394;3847;75004;With Spy Kids 2 : The Island of Lost Dreams , however , Robert Rodriguez adorns his family-film plot with an elegance and maturity that even most contemporary adult movies are lacking .;4
395;6333;118509;In a summer overrun with movies dominated by CGI aliens and super heroes , it revigorates the mind to see a feature that concentrates on people , a project in which the script and characters hold sway .;4
396;5918;111527;The only pain you 'll feel as the credits roll is your stomach grumbling for some tasty grub .;1
397;4125;80069;In that setting , their struggle is simply too ludicrous and borderline insulting .;0
398;7532;138953;A few energetic stunt sequences briefly enliven the film , but the wheezing terrorist subplot has n't the stamina for the 100-minute running time , and the protagonists ' bohemian boorishness mars the spirit of good clean fun .;2
399;3801;74181;One of the more glaring signs of this movie 's servitude to its superstar is the way it skirts around any scenes that might have required genuine acting from Ms. Spears .;0
400;1161;25379;Befuddled in its characterizations as it begins to seem as long as the two year affair which is its subject;1
401;2650;53438;A plethora of engaging diatribes on the meaning of ` home , ' delivered in grand passion by the members of the various households .;3
402;2538;51525;The animation and backdrops are lush and inventive , yet Return to Neverland never manages to take us to that elusive , lovely place where we suspend our disbelief .;2
403;4415;85376;It 's bedeviled by labored writing and slack direction .;1
404;4807;92342;One of the best rock documentaries ever .;4
405;2959;58685;Earnest but heavy-handed .;2
406;3355;66158;Lacks the spirit of the previous two , and makes all those jokes about hos and even more unmentionable subjects seem like mere splashing around in the muck .;0
407;7464;137951;Although Estela Bravo 's documentary is cloyingly hagiographic in its portrait of Cuban leader Fidel Castro , it 's still a guilty pleasure to watch .;3
408;4051;78732;Bad and baffling from the get-go .;0
409;526;12289;It 's about as convincing as any other Arnie musclefest , but has a little too much resonance with real world events and ultimately comes off as insultingly simplistic .;1
410;5926;111662;Secretary is just too original to be ignored .;3
411;4075;79127;Well-meaning to a fault , Antwone Fisher manages the dubious feat of turning one man 's triumph of will into everyman 's romance comedy .;2
412;4659;89576;If ever a concept came handed down from the movie gods on a silver platter , this is it .;4
413;714;16567;Possibly not since Grumpy Old Men have I heard a film so solidly connect with one demographic while striking out with another .;2
414;7405;136902;It 's up to you to decide whether to admire these people 's dedication to their cause or be repelled by their dogmatism , manipulativeness and narrow , fearful view of American life .;2
415;101;2614;-LRB- Green is -RRB- the comedy equivalent of Saddam Hussein , and I 'm just about ready to go to the U.N. and ask permission for a preemptive strike .;1
416;2778;55620;It 's at once laughable and compulsively watchable , in its committed dumbness .;3
417;7233;134020;One of those exceedingly rare films in which the talk alone is enough to keep us involved .;4
418;952;21289;Being unique does n't necessarily equate to being good , no matter how admirably the filmmakers have gone for broke .;1
419;7069;131158;Oscar caliber cast does n't live up to material;1
420;5258;100207;For those who are intrigued by politics of the '70s , the film is every bit as fascinating as it is flawed .;3
421;5919;111545;The threat;2
422;1428;30697;... gripping and handsome execution , -LRB- but -RRB- there is n't much about K-19 that 's unique or memorable .;2
423;4969;95232;It tends to remind one of a really solid Woody Allen film , with its excellent use of New York locales and sharp writing;4
424;238;5953;... a thoughtful what-if for the heart as well as the mind .;4
425;5157;98384;Most fish stories are a little peculiar , but this is one that should be thrown back in the river .;1
426;748;17224;The characterizations and dialogue lack depth or complexity , with the ironic exception of Scooter .;1
427;6347;118730;Talk to Her is so darned assured , we have absolutely no idea who the main characters are until the film is well under way -- and yet it 's hard to stop watching .;3
428;3950;76813;She 's a cipher , played by an actress who smiles and frowns but does n't reveal an inner life .;2
429;6195;116243;The slam-bang superheroics are kinetic enough to engross even the most antsy youngsters .;4
430;1747;36863;Far-fetched premise , convoluted plot , and thematic mumbo jumbo about destiny and redemptive love .;2
431;4908;94059;Mr. Deeds is not really a film as much as it is a loose collection of not-so-funny gags , scattered moments of lazy humor .;0
432;3765;73609;"It 's dark but has wonderfully funny moments ; you care about the characters ; and the action and special effects are first-rate .";4
433;2980;59057;You do n't know whether to admire the film 's stately nature and call it classicism or be exasperated by a noticeable lack of pace .;1
434;5024;96168;A great script brought down by lousy direction .;1
435;3504;68993;A chilling movie without oppressive gore .;3
436;1662;35337;It is supremely unfunny and unentertaining to watch middle-age and older men drink to excess , piss on trees , b.s. one another and put on a show in drag .;0
437;2775;55582;The entire movie establishes a wonderfully creepy mood .;4
