;SentenceId;PhraseId;Phrase;Sentiment
438;2280;46828;... will always be remembered for the 9-11 terrorist attacks .;2
439;7987;146798;If you can read the subtitles -LRB- the opera is sung in Italian -RRB- and you like ` Masterpiece Theatre ' type costumes , you 'll enjoy this movie .;3
440;2306;47310;in period costume and with a bigger budget .;2
441;7971;146511;It irritates and saddens me that Martin Lawrence 's latest vehicle can explode obnoxiously into 2,500 screens while something of Bubba Ho-Tep 's clearly evident quality may end up languishing on a shelf somewhere .;1
442;7586;139795;For dance completists only .;0
443;5618;106375;Dark and unrepentant , this excursion into the epicenter of percolating mental instability is not easily dismissed or forgotten .;3
444;1155;25269;This slender plot feels especially thin stretched over the nearly 80-minute running time .;1
445;8441;154424;Nonchalantly freaky and uncommonly pleasurable , Warm Water may well be the year 's best and most unpredictable comedy .;4
446;7633;140675;It 's about issues most adults have to face in marriage and I think that 's what I liked about it -- the real issues tucked between the silly and crude storyline .;3
447;692;16083;The huskies are beautiful , the border collie is funny and the overall feeling is genial and decent .;3
448;491;11429;This overproduced piece of dreck is shockingly bad and absolutely unnecessary .;0
449;1740;36726;It 's mildly amusing , but I certainly ca n't recommend it .;1
450;4860;93210;He thinks the film is just as much a document about him as it is about the subject .;1
451;2119;43703;Grainy photography mars an otherwise delightful comedy of errors .;2
452;8142;149589;Bolstered by exceptional performances and a clear-eyed take on the economics of dealing and the pathology of ghetto fabulousness .;4
453;7481;138229;Steven Spielberg brings us another masterpiece;4
454;3080;60984;The film grows on you .;3
455;2768;55454;It wo n't harm anyone , but neither can I think of a very good reason to rush right out and see it .;2
456;1523;32501;The Pianist -LRB- is -RRB- a supremely hopeful cautionary tale of war 's madness remembered that we , today , can prevent its tragic waste of life .;4
457;4683;89998;Bravo reveals the true intent of her film by carefully selecting interview subjects who will construct a portrait of Castro so predominantly charitable it can only be seen as propaganda .;2
458;1597;33976;"Wes Craven 's presence is felt ; not the Craven of ' A Nightmare on Elm Street ' or ` The Hills Have Eyes , ' but the sad schlock merchant of ` Deadly Friend . '";1
459;3661;71744;A headline-fresh thriller set among orthodox Jews on the West Bank , Joseph Cedar 's Time Of Favor manages not only to find a compelling dramatic means of addressing a complex situation , it does so without compromising that complexity .;3
460;8086;148626;Illiterate , often inert sci-fi action thriller .;1
461;2955;58639;The movie slides downhill as soon as macho action conventions assert themselves .;0
462;4503;86884;Yo , it 's The Days Of Our Lives meets Electric Boogaloo .;2
463;3354;66112;A journey spanning nearly three decades of bittersweet camaraderie and history , in which we feel that we truly know what makes Holly and Marina tick , and our hearts go out to them as both continue to negotiate their imperfect , love-hate relationship .;3
464;7868;144890;The most ill-conceived animated comedy since the 1991 dog Rover Dangerfield .;2
465;5339;101531;He 's a better actor than a standup comedian .;3
466;6010;113139;Why did they deem it necessary to document all this emotional misery ?;1
467;423;10051;Here 's a case of two actors who do everything humanly possible to create characters who are sweet and believable , and are defeated by a screenplay that forces them into bizarre , implausible behavior .;1
468;7272;134726;A fine documentary can be distinguished from a mediocre one by the better film 's ability to make its subject interesting to those who are n't part of its supposed target audience .;3
469;4036;78470;An intoxicating experience .;4
470;1519;32397;Yet another entry in the sentimental oh-those-wacky-Brits genre that was ushered in by The Full Monty and is still straining to produce another smash hit .;1
471;1723;36424;A knowing sense of humor and a lot of warmth ignite Son of the Bride .;4
472;141;3713;Poor editing , bad bluescreen , and ultra-cheesy dialogue highlight the radical action .;0
473;978;21840;The Emperor 's Club , ruthless in its own placid way , finds one of our most conservative and hidebound movie-making traditions and gives it new texture , new relevance , new reality .;4
474;3332;65719;If you ever wanted to be an astronaut , this is the ultimate movie experience - it 's informative and breathtakingly spectacular .;4
475;7288;135017;Several of Steven Soderbergh 's earlier films were hailed as the works of an artist .;3
476;3435;67636;I do n't think most of the people who loved the 1989 Paradiso will prefer this new version .;1
477;7652;141070;Disappointing in comparison to other recent war movies ... or any other John Woo flick for that matter .;1
478;7866;144866;In other words , about as bad a film you 're likely to see all year .;0
479;3030;60057;The writing is clever and the cast is appealing .;4
480;2850;56698;Never capitalizes on this concept and opts for the breezy and amateurish feel of an after school special on the subject of tolerance .;0
481;63;1687;Its generic villains lack any intrigue -LRB- other than their funny accents -RRB- and the action scenes are poorly delivered .;1
482;6695;124598;Wow , a jump cut !;2
483;1051;23207;To the vast majority of more casual filmgoers , it will probably be a talky bore .;1
484;787;18042;Coal is n't as easy to come by as it used to be and this would be a worthy substitute for naughty children 's stockings .;1
485;2353;48206;A case in point : Doug Pray 's Scratch .;2
486;4013;77968;As pedestrian as they come .;0
487;2924;58011;The film is enriched by an imaginatively mixed cast of antic spirits , headed by Christopher Plummer as the subtlest and most complexly evil Uncle Ralph I 've ever seen in the many film and stage adaptations of the work .;4
488;6778;126131;An allegory concerning the chronically mixed signals African American professionals get about overachieving could be intriguing , but the supernatural trappings only obscure the message .;1
489;4792;92059;What might 've been an exhilarating exploration of an odd love triangle becomes a sprawl of uncoordinated vectors .;2
490;3674;71946;Please see previous answer .;2
491;8157;149814;Exhilarating but blatantly biased .;3
492;6099;114625;A gratingly unfunny groaner littered with zero-dimensional , unlikable characters and hackneyed , threadbare comic setups .;0
493;6134;115150;The animation and game phenomenon that peaked about three years ago is actually dying a slow death , if the poor quality of Pokemon 4 Ever is any indication .;0
494;1253;27221;There is one surefire way to get a nomination for a best-foreign-film Oscar : Make a movie about whimsical folk who learn a nonchallenging , life-affirming lesson while walking around a foreign city with stunning architecture .;2
495;2009;41729;Slack and uninspired , and peopled mainly by characters so unsympathetic that you 're left with a sour taste in your mouth .;0
496;1078;23723;-LRB- A -RRB- slummer .;1
497;7513;138658;The story 's pathetic and the gags are puerile . .;0
498;1612;34339;Squandering his opportunity to make absurdist observations , Burns gets caught up in the rush of slapstick thoroughfare .;1
499;3623;71048;An entertaining documentary that freshly considers arguments the Bard 's immortal plays were written by somebody else .;3
500;4651;89459;A sour attempt at making a Farrelly Brothers-style , down-and-dirty laugher for the female set .;1
501;589;13677;Hashiguchi uses the situation to evoke a Japan bustling atop an undercurrent of loneliness and isolation .;3
502;2028;42138;Belongs in the too-hot-for-TV direct-to-video\/DVD category , and this is why I have given it a one-star rating .;1
503;4870;93375;One can only assume that the jury who bestowed star Hoffman 's brother Gordy with the Waldo Salt Screenwriting award at 2002 's Sundance Festival were honoring an attempt to do something different over actually pulling it off;1
504;8080;148494;The first hour is tedious though Ford and Neeson capably hold our interest , but its just not a thrilling movie .;1
505;3703;72454;A boring , pretentious muddle that uses a sensational , real-life 19th-Century crime as a metaphor for -- well , I 'm not exactly sure what -- and has all the dramatic weight of a raindrop .;0
506;3583;70314;They cheapen the overall effect .;1
507;2082;43108;Elling builds gradually until you feel fully embraced by this gentle comedy .;3
508;7250;134404;Bogdanovich taps deep into the Hearst mystique , entertainingly reenacting a historic scandal .;4
509;3902;76035;Most of the film feels conceived and shot on the fly -- like between lunch breaks for Shearer 's radio show and his Simpson voice-overs .;2
510;7492;138394;Melodrama with a message .;2
511;5573;105539;Depending upon your reaction to this movie , you may never again be able to look at a red felt Sharpie pen without disgust , a thrill , or the giggles .;2
512;2394;49018;The film 's final hour , where nearly all the previous unseen material resides , is unconvincing soap opera that Tornatore was right to cut .;1
513;498;11570;She nearly glows with enthusiasm , sensuality and a conniving wit .;3
514;8543;156032;The movie 's downfall is to substitute plot for personality .;1
515;1937;40493;The modern-day characters are nowhere near as vivid as the 19th-century ones .;1
516;1111;24431;At least it 's a fairly impressive debut from the director , Charles Stone III .;4
517;4895;93824;` Like a child with an important message to tell ... -LRB- Skins ' -RRB- faults are easy to forgive because the intentions are lofty . ';2
518;4238;82127;Matches neorealism 's impact by showing the humanity of a war-torn land filled with people who just want to live their lives .;2
519;5057;96804;You 'll probably love it .;4
520;6091;114504;The story ultimately takes hold and grips hard .;4
521;4606;88641;This odd , distant Portuguese import more or less borrows from Bad Lieutenant and Les Vampires , and comes up with a kind of art-house gay porn film .;1
522;3102;61366;It 's also curious to note that this film , like the similarly ill-timed Antitrust , is easily as bad at a fraction the budget .;0
523;2615;52794;Blessed with two fine , nuanced lead performances .;3
524;3220;63606;The movie , like Bartleby , is something of a stiff -- an extra-dry office comedy that seems twice as long as its 83 minutes .;1
525;694;16124;moved;3
526;4858;93194;It 's quite another to feel physically caught up in the process .;2
527;6341;118641;If there 's no art here , it 's still a good yarn -- which is nothing to sneeze at these days .;3
528;2653;53509;Despite its visual virtuosity , ` Naqoyqatsi ' is banal in its message and the choice of material to convey it .;1
529;819;18665;All the actors are good in Pauline & Paulette but van der Groen , described as ` Belgium 's national treasure , ' is especially terrific as Pauline .;2
530;175;4595;... the one thing this Wild film has that other Imax films do n't : chimps , lots of chimps , all blown up to the size of a house .;2
531;5581;105717;The movie is not as terrible as the synergistic impulse that created it .;1
532;2126;43875;Harmless fun .;3
533;254;6391;Some of the computer animation is handsome , and various amusing sidekicks add much-needed levity to the otherwise bleak tale , but overall the film never rises above mediocrity .;1
534;7609;140211;O Fantasma is boldly , confidently orchestrated , aesthetically and sexually , and its impact is deeply and rightly disturbing .;3
535;171;4515;Nothing more than an amiable but unfocused bagatelle that plays like a loosely-connected string of acting-workshop exercises .;0
536;5256;100172;A fascinating , bombshell documentary that should shame Americans , regardless of whether or not ultimate blame finally lies with Kissinger .;4
537;1531;32661;At once overly old-fashioned in its sudsy plotting and heavy-handed in its effort to modernize it with encomia to diversity and tolerance .;1
538;4714;90548;A low-budget affair , Tadpole was shot on digital video , and the images often look smeary and blurry , to the point of distraction .;0
539;626;14542;Exploits -LRB- headbanger -RRB- stereotypes in good fun , while adding a bit of heart and unsettling subject matter .;3
540;6808;126609;Director-writer Bille August ... depicts this relationship with economical grace , letting his superb actors convey Martin 's deterioration and Barbara 's sadness -- and , occasionally , anger .;2
541;3402;67018;Like the Tuck family themselves , this movie just goes on and on and on and on;0
542;7608;140198;Reign of Fire just might go down as one of the all-time great apocalypse movies .;3
543;381;9112;Every individual will see the movie through the prism of his or her own beliefs and prejudices , but the one thing most will take away is the sense that peace is possible .;4
544;2921;57957;More than their unique residences , Home Movie is about the people who live in them , who have carved their own comfortable niche in the world and have been kind enough to share it .;4
545;2715;54592;The comedy makes social commentary more palatable .;2
546;1085;23882;Family portrait of need , neurosis and nervy negativity is a rare treat that shows the promise of digital filmmaking .;3
547;5966;112337;Almost nothing else -- raunchy and graphic as it may be in presentation -- is one-sided , outwardly sexist or mean-spirited .;2
548;166;4382;Kim Ki-Deok seems to have in mind an -LRB- emotionally at least -RRB- adolescent audience demanding regular shocks and bouts of barely defensible sexual violence to keep it interested .;1
549;4113;79818;It 's a long way from Orwell 's dark , intelligent warning cry -LRB- 1984 -RRB- to the empty stud knockabout of Equilibrium , and what once was conviction is now affectation .;1
550;2478;50395;A savage John Waters-like humor that dances on the edge of tastelessness without ever quite falling over .;2
551;3415;67287;Despite the surface attractions -- Conrad L. Hall 's cinematography will likely be nominated for an Oscar next year -- there 's something impressive and yet lacking about everything .;3
552;370;8880;How do you make a movie with depth about a man who lacked any ?;1
553;362;8693;An unsophisticated sci-fi drama that takes itself all too seriously .;1
554;6758;125790;There 's no question that Epps scores once or twice , but it 's telling that his funniest moment comes when he falls about ten feet onto his head .;2
555;2149;44329;You can fire a torpedo through some of Clancy 's holes , and the scripters do n't deserve any Oscars .;0
556;410;9829;Hilarious musical comedy though stymied by accents thick as mud .;2
557;2723;54716;We do n't get paid enough to sit through crap like this .;0
558;2205;45351;A charming , banter-filled comedy ... one of those airy cinematic bon bons whose aims -- and by extension , accomplishments -- seem deceptively slight on the surface .;3
559;5979;112573;` The film is stark , straightforward and deadly ... an unnatural calm that 's occasionally shaken by ... blasts of rage , and later , violent jealousy . ';2
560;6618;123290;"Changing Lanes is an anomaly for a Hollywood movie ; it 's a well-written and occasionally challenging social drama that actually has something interesting to say .";4
561;7191;133272;This is the first full scale WWII flick from Hong Kong 's John Woo .;2
562;8131;149400;A wildly entertaining scan of Evans ' career .;4
563;3625;71071;A half-assed film .;0
564;8418;154088;If you can swallow its absurdities and crudities Lagaan really is enormously good fun .;3
565;5361;101839;Remarkable for its excellent storytelling , its economical , compressed characterisations and for its profound humanity , it 's an adventure story and history lesson all in one .;4
566;3251;64238;Hollywood 's answer to an air ball .;2
567;4491;86688;No amount of burning , blasting , stabbing , and shooting can hide a weak script .;0
568;6303;117990;Ms. Seigner and Mr. Serrault bring fresh , unforced naturalism to their characters .;4
569;2232;45882;A creepy , intermittently powerful study of a self-destructive man ... about as unsettling to watch as an exploratory medical procedure or an autopsy .;3
570;6921;128676;It 's not so much a movie as a joint promotion for the National Basketball Association and teenaged rap and adolescent poster-boy Lil ' Bow Wow .;1
571;5285;100662;A muddy psychological thriller rife with miscalculations .;1
572;8172;150032;There 's no good answer to that one .;1
573;5648;106943;As commander-in-chief of this film , Bigelow demonstrates a breadth of vision and an attention to detail that propels her into the upper echelons of the directing world .;4
574;4208;81589;All in all , Brown Sugar is a satisfying well-made romantic comedy that 's both charming and well acted .;4
575;1884;39448;A reworking of Die Hard and Cliffhanger but it 's nowhere near as exciting as either .;1
576;3117;61691;Occasionally interesting but essentially unpersuasive , a footnote to a still evolving story .;2
577;896;20140;Feels more like a rejected X-Files episode than a credible account of a puzzling real-life happening .;0
578;6429;120221;Making such a tragedy the backdrop to a love story risks trivializing it , though Chouraqui no doubt intended the film to affirm love 's power to help people endure almost unimaginable horror .;3
579;8482;155012;We can tell what it is supposed to be , but ca n't really call it a work of art .;1
580;837;19080;Once again , the intelligence of gay audiences has been grossly underestimated , and a meaty plot and well-developed characters have been sacrificed for skin and flash that barely fizzle .;2
581;3633;71194;As a vehicle to savour Binoche 's skill , the film is well worthwhile .;4
582;1979;41255;The touch is generally light enough and the performances , for the most part , credible .;3
583;6053;113872;If you do n't flee , you might be seduced .;2
584;3824;74573;What more can be expected from a college comedy that 's target audience has n't graduated from junior high school ?;0
585;7590;139897;What Lee does so marvelously compelling is present Brown as a catalyst for the struggle of black manhood in restrictive and chaotic America ... sketchy but nevertheless gripping portrait of Jim Brown , a celebrated wonder in the spotlight;3
586;3668;71869;Eastwood winces , clutches his chest and gasps for breath .;2
587;8178;150134;"No cute factor here ... Not that I mind ugly ; the problem is he has no character , loveable or otherwise .";0
588;8340;152818;Snipes relies too much on a scorchingly plotted dramatic scenario for its own good .;2
589;7748;142757;I ca n't remember the last time I saw an audience laugh so much during a movie , but there 's only one problem ... it 's supposed to be a drama .;2
590;6422;120072;This is a stunning film , a one-of-a-kind tour de force .;4
591;3880;75680;Adults will certainly want to spend their time in the theater thinking up grocery lists and ways to tell their kids how not to act like Pinocchio .;2
592;6900;128226;In all fairness , I must report that the children of varying ages in my audience never coughed , fidgeted or romped up and down the aisles for bathroom breaks .;3
593;6584;122715;An unremarkable , modern action\/comedy buddy movie whose only nod to nostalgia is in the title .;2
594;808;18423;It may be a no-brainer , but at least it 's a funny no-brainer .;3
595;4823;92576;Rather , pity anyone who sees this mishmash .;0
596;6045;113727;Ozpetek joins the ranks of those gay filmmakers who have used the emigre experience to explore same-sex culture in ways that elude the more nationally settled .;2
597;4472;86371;It 's a lot to ask people to sit still for two hours and change watching such a character , especially when rendered in as flat and impassive a manner as Phoenix 's .;1
598;4493;86718;Nohe 's documentary about the event is sympathetic without being gullible : He is n't blind to the silliness , but also captures moments of spontaneous creativity and authentic co-operative interaction .;3
599;8342;152849;The Sweetest Thing , a romantic comedy with outrageous tendencies , may be a mess in a lot of ways .;2
600;1778;37446;One of the best films of the year with its exquisite acting , inventive screenplay , mesmerizing music , and many inimitable scenes of tenderness , loss , discontent , and yearning .;4
601;1643;34913;It seems impossible that an epic four-hour Indian musical about a cricket game could be this good , but it is .;3
602;1837;38530;It 's a mindless action flick with a twist -- far better suited to video-viewing than the multiplex .;1
603;6443;120497;Completely awful Iranian drama ... as much fun as a grouchy ayatollah in a cold mosque .;0
604;1466;31338;To say that this vapid vehicle is downright doltish and uneventful is just as obvious as telling a country skunk that he has severe body odor .;0
605;5301;100933;Though the aboriginal aspect lends the ending an extraordinary poignancy , and the story itself could be played out in any working class community in the nation .;3
606;6835;127081;The only thing that distinguishes a Randall Wallace film from any other is the fact that there is nothing distinguishing in a Randall Wallace film .;0
607;7138;132370;While this movie , by necessity , lacks Fellowship 's heart , Two Towers outdoes its spectacle .;3
608;1201;26204;hard as this may be to believe , Here on Earth , a surprisingly similar teen drama , was a better film .;1
609;4294;83177;The fourth in a series that I 'll bet most parents had thought -- hoped !;2
610;3893;75878;Plummer steals the show without resorting to camp as Nicholas ' wounded and wounding Uncle Ralph .;3
611;5472;103783;There 's a persistent theatrical sentiment and a woozy quality to the manner of the storytelling , which undercuts the devastatingly telling impact of utter loss personified in the film 's simple title .;1
612;8296;152035;In a big corner office in Hell , Satan is throwing up his hands in surrender , is firing his R&D people , and has decided he will just screen The Master of Disguise 24\/7 .;0
613;7751;142809;Not only does the thoroughly formulaic film represent totally exemplify middle-of-the-road mainstream , it also represents glossy Hollywood at its laziest .;0
614;1987;41351;The whole thing comes off like a particularly amateurish episode of Bewitched that takes place during Spring Break .;1
615;8343;152863;Has its moments -- and almost as many subplots .;3
616;5846;110378;Overall tomfoolery like this is a matter of taste .;1
617;5619;106397;A pleasing , often-funny comedy .;3
618;7638;140785;Further sad evidence that Tom Tykwer , director of the resonant and sense-spinning Run Lola Run , has turned out to be a one-trick pony -- a maker of softheaded metaphysical claptrap .;0
619;1592;33911;The Fast Runner ' transports the viewer into an unusual space;2
620;5707;107896;-LRB- The film 's -RRB- taste for `` shock humor '' will wear thin on all but those weaned on the comedy of Tom Green and the Farrelly Brothers .;1
621;3516;69196;The leads we are given here are simply too bland to be interesting .;1
622;6819;126812;A worthwhile documentary , whether you 're into rap or not , even if it may still leave you wanting more answers as the credits roll .;3
623;6774;126103;Stale and;0
624;567;13190;A thriller whose style , structure and rhythms are so integrated with the story , you can not separate them .;3
625;1775;37389;`` Not really as bad as you might think ! '';2
626;4998;95680;Writer-director Walter Hill and co-writer David Giler try to create characters out of the obvious cliches , but wind up using them as punching bags .;1
627;3807;74301;This is lightweight filmmaking , to be sure , but it 's pleasant enough -- and oozing with attractive men .;3
628;5983;112668;Stands as a document of what it felt like to be a New Yorker -- or , really , to be a human being -- in the weeks after 9\/11 .;3
629;5970;112399;K-19 : The Widowmaker is derivative , overlong , and bombastic -- yet surprisingly entertaining .;3
630;5617;106370;An almost unbearably morbid love story .;0
631;1790;37643;Nights feels more like a quickie TV special than a feature film ... It 's not even a TV special you 'd bother watching past the second commercial break .;1
632;5405;102627;A compelling yarn , but not quite a ripping one .;3
633;14;364;Fresnadillo has something serious to say about the ways in which extravagant chance can distort our perspective and throw us off the path of good sense .;3
634;2688;54097;Sure , it 's contrived and predictable , but its performances are so well tuned that the film comes off winningly , even though it 's never as solid as you want it to be .;3
635;6365;119080;Each punch seen through prison bars , the fights become not so much a struggle of man vs. man as Brother-Man vs. The Man .;2
636;4120;79974;Gere gives a good performance in a film that does n't merit it .;2
637;5603;106093;"A colorful , joyous celebration of life ; a tapestry woven of romance , dancing , singing , and unforgettable characters .";4
638;4347;84143;My Big Fat Greek Wedding is that rare animal known as ' a perfect family film , ' because it 's about family .;3
639;1176;25740;It 's still a comic book , but Maguire makes it a comic book with soul .;3
640;3018;59831;Lovingly photographed in the manner of a Golden Book sprung to life , Stuart Little 2 manages sweetness largely without stickiness .;4
