;SentenceId;PhraseId;Phrase;Sentiment
4691;1340;28920;Becomes the last thing you would expect from a film with this title or indeed from any Plympton film : boring .;1
4692;143;3760;It gets the details of its time frame right but it completely misses its emotions .;1
4693;7054;130875;essentially `` Fatal Attraction '' remade for viewers who were in diapers when the original was released in 1987 .;1
4694;4558;87770;Please , someone , stop Eric Schaeffer before he makes another film .;0
4695;7295;135144;It is n't that the picture is unfamiliar , but that it manages to find new avenues of discourse on old problems .;2
4696;534;12449;It 's actually too sincere -- the crime movie equivalent of a chick flick .;2
4697;2618;52831;If you 're a comic fan , you ca n't miss it .;4
4698;6246;117068;Likely to have decades of life as a classic movie franchise ?;3
4699;2948;58495;A movie more to be prescribed than recommended -- as visually bland as a dentist 's waiting room , complete with soothing Muzak and a cushion of predictable narrative rhythms .;0
4700;4421;85474;K-19 will not go down in the annals of cinema as one of the great submarine stories , but it is an engaging and exciting narrative of Man confronting the Demons of his own fear and paranoia .;3
4701;326;7974;Nothing but an episode of Smackdown !;1
4702;4384;84752;It 's a setup so easy it borders on facile , but keeping the film from cheap-shot mediocrity is its crack cast .;3
4703;3665;71837;Sweet and memorable film .;4
4704;7906;145461;The Piano Teacher is not an easy film .;1
4705;5831;110101;There 's something fishy about a seasonal holiday kids ' movie ... that derives its moment of most convincing emotional gravity from a scene where Santa gives gifts to grownups .;1
4706;4100;79636;It 's tough being a black man in America , especially when the Man has taken away your car , your work-hours and denied you health insurance .;2
4707;3701;72409;It 's a testament to the film 's considerable charm that it succeeds in entertaining , despite playing out like a feature-length sitcom replete with stereotypical familial quandaries .;3
4708;5826;109994;It 's a boom-box of a movie that might have been titled ` The Loud and the Ludicrous ' ... the pandering to a moviegoing audience dominated by young males is all too calculated .;2
4709;3320;65535;A high-spirited buddy movie about the reunion of Berlin anarchists who face arrest 15 years after their crime .;3
4710;4037;78472;The movie worked for me right up to the final scene , and then it caved in .;2
4711;2272;46670;The director , Mark Pellington , does a terrific job conjuring up a sinister , menacing atmosphere though unfortunately all the story gives us is flashing red lights , a rattling noise , and a bump on the head .;3
4712;6243;117014;There is no solace here , no entertainment value , merely a fierce lesson in where filmmaking can take us .;1
4713;3383;66626;Merely -LRB- and literally -RRB- tosses around sex toys and offers half-hearted paeans to empowerment that are repeatedly undercut by the brutality of the jokes , most at women 's expense .;0
4714;4108;79764;Explosions , jokes , and sexual innuendoes abound .;2
4715;8219;150801;This is a movie full of grace and , ultimately , hope .;4
4716;7055;130895;Does n't do more than expand a TV show to movie length .;1
4717;8241;151159;-LRB- Allen -RRB- manages to breathe life into this somewhat tired premise .;3
4718;6503;121400;The film 's unhurried pace is actually one of its strengths .;3
4719;6400;119654;How about starting with a more original story instead of just slapping extreme humor and gross-out gags on top of the same old crap ?;2
4720;6277;117632;` Martin Lawrence Live ' is so self-pitying , I almost expected there to be a collection taken for the comedian at the end of the show .;0
4721;2870;57014;Feels shrill , simple and soapy .;1
4722;4938;94605;Insanely hilarious !;4
4723;298;7298;There is simply no doubt that this film asks the right questions at the right time in the history of our country .;4
4724;6163;115623;This fascinating look at Israel in ferment feels as immediate as the latest news footage from Gaza and , because of its heightened , well-shaped dramas , twice as powerful .;4
4725;8182;150205;It does n't flinch from its unsettling prognosis , namely , that the legacy of war is a kind of perpetual pain .;1
4726;7626;140529;Very amusing , not the usual route in a thriller , and the performances are odd and pixilated and sometimes both .;3
4727;5997;112924;Barely .;2
4728;3297;65160;Pacino is the best he 's been in years and Keener is marvelous .;4
4729;3401;66978;Weirdly , Broomfield has compelling new material but he does n't unveil it until the end , after endless scenes of him wheedling reluctant witnesses and pointing his camera through the smeared windshield of his rental car .;1
4730;5232;99718;It 's so devoid of joy and energy it makes even Jason X ... look positively Shakesperean by comparison .;0
4731;4673;89792;plays like an unbalanced mixture of graphic combat footage and almost saccharine domestic interludes that are pure Hollywood .;1
4732;7514;138666;Where their heads were is anyone 's guess .;1
4733;8067;148233;The film is bright and flashy in all the right ways .;4
4734;1227;26750;Compellingly watchable .;4
4735;1069;23581;Blue Crush is as predictable as the tides .;1
4736;860;19585;It will break your heart many times over .;2
4737;4201;81465;It 's crafty , energetic and smart -- the kid is sort of like a fourteen-year old Ferris Bueller .;4
4738;6728;125210;Hawke 's film , a boring , pretentious waste of nearly two hours , does n't tell you anything except that the Chelsea Hotel today is populated by whiny , pathetic , starving and untalented artistes .;1
4739;1403;30210;Ryosuke has created a wry , winning , if languidly paced , meditation on the meaning and value of family .;2
4740;4549;87605;A plodding look at the French Revolution through the eyes of aristocrats .;2
4741;6783;126214;the past via surrealist flourishes;3
4742;6701;124694;Without Shakespeare 's eloquent language , the update is dreary and sluggish .;0
4743;3165;62574;In Auteil 's less dramatic but equally incisive performance , he 's a charismatic charmer likely to seduce and conquer .;3
4744;3976;77287;Whether or not Ram Dass proves as clear and reliable an authority on that as he was about inner consciousness , Fierce Grace reassures us that he will once again be an honest and loving one .;3
4745;1454;31143;You wo n't have any trouble getting kids to eat up these Veggies .;3
4746;6703;124730;It 's the type of stunt the Academy loves : a powerful political message stuffed into an otherwise mediocre film .;2
4747;6352;118856;The pain , loneliness and insecurity of the screenwriting process are vividly and painfully brought to slovenly life in this self-deprecating , biting and witty feature written by Charlie Kaufman and his twin brother , Donald , and directed by Spike Jonze .;3
4748;5709;107940;Uplifting as only a document of the worst possibilities of mankind can be , and among the best films of the year .;4
4749;3937;76552;It 's been done before but never so vividly or with so much passion .;4
4750;5566;105386;What makes Salton Sea surprisingly engrossing is that Caruso takes an atypically hypnotic approach to a world that 's often handled in fast-edit , hopped-up fashion .;4
4751;6427;120192;A technical triumph and an extraordinary bore .;1
4752;772;17791;Just the labour involved in creating the layered richness of the imagery in this chiaroscuro of madness and light is astonishing .;4
4753;4293;83156;Robin Williams has thankfully ditched the saccharine sentimentality of Bicentennial Man in favour of an altogether darker side .;3
4754;8047;147881;The engagingly primitive animated special effects contribute to a mood that 's sustained through the surprisingly somber conclusion .;3
4755;2631;53050;Rashomon-for-dipsticks tale .;0
4756;3277;64712;Like Mike is a slight and uninventive movie : Like the exalted Michael Jordan referred to in the title , many can aspire but none can equal .;1
4757;8073;148354;Although melodramatic and predictable , this romantic comedy explores the friendship between five Filipino-Americans and their frantic efforts to find love .;2
4758;328;7999;Perhaps a better celebration of these unfairly dismissed heroes would be a film that is n't this painfully forced , false and fabricated .;1
4759;6828;126988;It 's endlessly inventive , consistently intelligent and sickeningly savage .;4
4760;2131;43967;Spielberg 's first real masterpiece , it deserved all the hearts it won -- and wins still , 20 years later .;4
4761;5606;106153;A cautionary tale about the grandiosity of a college student who sees himself as impervious to a fall .;2
4762;4288;83073;Shreve 's graceful dual narrative gets clunky on the screen , and we keep getting torn away from the compelling historical tale to a less-compelling soap opera .;1
4763;595;13784;There is something that is so meditative and lyrical about Babak Payami 's boldly quirky Iranian drama Secret Ballot ... a charming and evoking little ditty that manages to show the gentle and humane side of Middle Eastern world politics;3
4764;2003;41615;His best film remains his shortest , The Hole , which makes many of the points that this film does but feels less repetitive .;2
4765;2384;48829;Swims in mediocrity , sticking its head up for a breath of fresh air now and then .;0
4766;8048;147898;Hip-hop prison thriller of stupefying absurdity .;1
4767;6193;116217;A terrific B movie -- in fact , the best in recent memory .;4
4768;4766;91580;Shyamalan offers copious hints along the way -- myriad signs , if you will -- that beneath the familiar , funny surface is a far bigger , far more meaningful story than one in which little green men come to Earth for harvesting purposes .;3
4769;6929;128810;If you 're part of her targeted audience , you 'll cheer .;3
4770;2774;55546;Why sit through a crummy , wannabe-hip crime comedy that refers incessantly to old movies , when you could just rent those movies instead , let alone seek out a respectable new one ?;0
4771;4661;89612;Admirably ambitious but self-indulgent .;2
4772;8337;152768;A beguiling evocation of the quality that keeps Dickens evergreen : the exuberant openness with which he expresses our most basic emotions .;3
4773;3903;76061;The main story ... is compelling enough , but it 's difficult to shrug off the annoyance of that chatty fish .;1
4774;6528;121822;There 's the plot , and a maddeningly insistent and repetitive piano score that made me want to scream .;1
4775;5903;111317;Unfortunately , the experience of actually watching the movie is less compelling than the circumstances of its making .;0
4776;2805;56065;The comedy Death to Smoochy is a rancorous curiosity : a movie without an apparent audience .;1
4777;8156;149800;An awful movie that will only satisfy the most emotionally malleable of filmgoers .;0
4778;5270;100450;The artwork is spectacular and unlike most animaton from Japan , the characters move with grace and panache .;4
4779;7366;136246;Both flawed and delayed , Martin Scorcese 's Gangs of New York still emerges as his most vital work since GoodFellas .;2
4780;2150;44351;A non-Britney person might survive a screening with little harm done , except maybe for the last 15 minutes , which are as maudlin as any after-school special you can imagine .;1
4781;5770;108989;And for many of us , that 's good enough .;3
4782;6293;117848;Neither a rousing success nor a blinding embarrassment .;2
4783;3434;67627;Despite the film 's shortcomings , the stories are quietly moving .;3
4784;6315;118221;This is n't a retooled genre piece , the tale of a guy and his gun , but an amiably idiosyncratic work .;2
4785;5344;101574;This New Zealand coming-of-age movie is n't really about anything .;1
4786;5715;108022;A funny , triumphant , and moving documentary .;4
4787;1550;33062;It 's just hard to believe that a life like this can sound so dull .;1
4788;7612;140263;The original was n't a good movie but this remake makes it look like a masterpiece !;0
4789;3405;67076;Return to Never Land is much more P.C. than the original version -LRB- no more racist portraits of Indians , for instance -RRB- , but the excitement is missing .;1
4790;7432;137355;Yet another Arnold vehicle that fails to make adequate use of his particular talents .;1
4791;2198;45234;One of the very best movies ever made about the life of moviemaking .;4
4792;7207;133585;Hashiguchi covers this territory with wit and originality , suggesting that with his fourth feature -- the first to be released in the U.S. -- a major director is emerging in world cinema .;4
4793;8358;153063;... its solemn pretension prevents us from sharing the awe in which it holds itself .;1
4794;2882;57227;Aggravating and tedious .;0
4795;8179;150155;A remarkable movie with an unsatisfying ending , which is just the point .;3
4796;1010;22389;Stone seems to have a knack for wrapping the theater in a cold blanket of urban desperation .;1
4797;1449;31059;It winds up moving in many directions as it searches -LRB- vainly , I think -RRB- for something fresh to say .;1
4798;5599;106057;Watching Austin Powers in Goldmember is like binging on cotton candy .;3
4799;149;3905;Because Eight Legged Freaks is partly an homage to Them , Tarantula and other low - budget B-movie thrillers of the 1950s and '60s , the movie is a silly -LRB- but not sophomoric -RRB- romp through horror and hellish conditions .;2
4800;4209;81605;Stitch is a bad mannered , ugly and destructive little \*\*\*\* .;0
4801;2251;46255;Potty-mouthed enough for PG-13 , yet not as hilariously raunchy as South Park , this strangely schizo cartoon seems suited neither to kids or adults .;1
4802;4718;90635;the Venezuelans say things like `` si , pretty much '' and `` por favor , go home '' when talking to Americans .;2
4803;3449;67919;A sad and rote exercise in milking a played-out idea -- a straight guy has to dress up in drag -- that shockingly manages to be even worse than its title would imply .;1
4804;2375;48626;The dramatic crisis does n't always succeed in its quest to be taken seriously , but Huppert 's volatile performance makes for a riveting movie experience .;2
4805;2109;43561;-- but certainly hard to hate .;3
4806;424;10090;Any enjoyment will be hinge from a personal threshold of watching sad but endearing characters do extremely unconventional things .;3
4807;2722;54684;I 'm not sure which will take longer to heal : the welt on Johnny Knoxville 's stomach from a riot-control projectile or my own tortured psyche .;0
4808;6415;119939;An Inuit masterpiece that will give you goosebumps as its uncanny tale of love , communal discord , and justice unfolds .;4
4809;6430;120251;Instead of contriving a climactic hero 's death for the beloved-major - character-who-shall - remain-nameless , why not invite some genuine spontaneity into the film by having the evil aliens ' laser guns actually hit something for once ?;1
4810;4878;93546;If you 've the patience , there are great rewards here .;3
4811;2652;53488;Ourside the theatre Roger might be intolerable company , but inside it he 's well worth spending some time with .;4
4812;4468;86281;Transcends its agenda to deliver awe-inspiring , at times sublime , visuals and offer a fascinating glimpse into the subculture of extreme athletes whose derring-do puts the X into the games .;4
4813;4409;85274;Believability was n't one of the film 's virtues .;1
4814;5114;97684;One of the most original American productions this year , you 'll find yourself remembering this refreshing visit to a Sunshine State .;4
4815;4070;79068;A riveting story well told .;4
4816;2501;50837;The Four Feathers is definitely horse feathers , but if you go in knowing that , you might have fun in this cinematic sandbox .;3
4817;7956;146297;Deuces Wild treads heavily into Romeo and Juliet\/West Side Story territory , where it plainly has no business going .;1
4818;3590;70429;A relentless , bombastic and ultimately empty World War II action flick .;1
4819;1370;29561;The lively appeal of The Last Kiss lies in the ease with which it integrates thoughtfulness and pasta-fagioli comedy .;4
4820;2030;42176;A wordy wisp of a comedy .;2
4821;809;18437;I liked the movie , but I know I would have liked it more if it had just gone that one step further .;3
4822;4788;92009;` Enigma ' is the kind of engaging historical drama that Hollywood appears to have given up on in favor of sentimental war movies in the vein of ` We Were Soldiers . ';2
4823;3573;70165;A movie that seems motivated more by a desire to match mortarboards with Dead Poets Society and Good Will Hunting than by its own story .;2
4824;1831;38435;would have been benefited from a sharper , cleaner script before it went in front of the camera .;2
4825;8183;150226;If you recognize Zeus -LRB- the dog from Snatch -RRB- it will make you wish you were at home watching that movie instead of in the theater watching this one .;1
4826;1515;32307;-LRB- Soderbergh -RRB- tends to place most of the psychological and philosophical material in italics rather than trust an audience 's intelligence , and he creates an overall sense of brusqueness .;1
4827;8084;148569;No amount of arty theorizing -- the special effects are ` German-Expressionist , ' according to the press notes -- can render it anything but laughable .;0
4828;1330;28708;A manipulative feminist empowerment tale thinly posing as a serious drama about spousal abuse .;1
4829;1000;22255;Action - mechanical .;1
4830;5396;102503;Graphic sex may be what 's attracting audiences to Unfaithful , but gripping performances by Lane and Gere are what will keep them awake .;4
4831;7561;139421;It 's no accident that The Accidental Spy is a solid action pic that returns the martial arts master to top form .;4
4832;1130;24772;The film will appeal to Discovery Channel fans and will surely widen the perspective of those of us who see the continent through rose-colored glasses .;2
4833;1956;40812;Both Grant and Hoult carry the movie because they are believable as people -- flawed , assured of the wrong things , and scared to admit how much they may really need the company of others .;3
4834;7732;142472;Every note rings false .;1
4835;5727;108234;Boyd 's screenplay -LRB- co-written with Guardian hack Nick Davies -RRB- has a florid turn of phrase that owes more to Guy Ritchie than the Bard of Avon .;1
4836;1992;41444;A quaint , romanticized rendering .;3
4837;1511;32237;The characters are complex and quirky , but entirely believable as the remarkable ensemble cast brings them to life .;4
4838;1848;38754;Both deserve better .;1
4839;5131;97956;Serving Sara should be served an eviction notice at every theater stuck with it .;1
4840;8193;150382;Assayas ' ambitious , sometimes beautiful adaptation of Jacques Chardonne 's novel .;3
4841;1090;24005;Watching a Brian DePalma movie is like watching an Alfred Hitchcock movie after drinking twelve beers .;1
4842;6861;127542;A shoddy male hip hop fantasy filled with guns , expensive cars , lots of naked women and Rocawear clothing .;1
4843;6338;118595;It 's been 20 years since 48 Hrs .;2
4844;7722;142329;Cox offers plenty of glimpses at existing photos , but there are no movies of Nijinsky , so instead the director treats us to an aimless hodgepodge .;0
4845;4712;90517;Human Nature is a goofball movie , in the way that Malkovich was , but it tries too hard .;3
4846;4131;80176;Is not so much a work of entertainment as it is a unique , well-crafted psychological study of grief .;4
4847;1102;24230;Lohman adapts to the changes required of her , but the actress and director Peter Kosminsky never get the audience to break through the wall her character erects;2
4848;8081;148514;Steven Soderbergh 's digital video experiment is a clever and cutting , quick and dirty look at modern living and movie life .;3
4849;6927;128788;It 's a strange film , one that was hard for me to warm up to .;1
4850;6838;127146;Writer\/director Alexander Payne -LRB- Election -RRB- and his co-writer Jim Taylor brilliantly employ their quirky and fearless ability to look American angst in the eye and end up laughing .;3
4851;5854;110496;But Death to Smoochy keeps firing until the bitter end .;2
4852;7758;142925;A penetrating glimpse into the tissue-thin ego of the stand-up comic .;2
4853;5342;101559;A deliciously nonsensical comedy about a city coming apart at its seams .;4
4854;3527;69371;... an eerily suspenseful , deeply absorbing piece that works as a treatise on spirituality as well as a solid sci-fi thriller .;4
4855;1669;35466;... another example of how Sandler is losing his touch .;1
4856;832;18943;Decasia is what has happened already to so many silent movies , newsreels and the like .;2
4857;6426;120151;Instead of a witty expose on the banality and hypocrisy of too much kid-vid , we get an ugly , mean-spirited lashing out by an adult who 's apparently been forced by his kids to watch too many Barney videos .;1
4858;1606;34159;A decent-enough nail-biter that stands a good chance of being the big hit Franklin needs to stay afloat in Hollywood .;3
4859;3564;70011;has some visual wit ... but little imagination elsewhere .;2
4860;5433;103078;The best film of the year 2002 .;3
4861;231;5798;Williams plays Sy , another of his open-faced , smiling madmen , like the killer in Insomnia .;2
4862;2789;55756;`` What John does is heroic , but we do n't condone it , '' one of the film 's stars recently said , a tortuous comment that perfectly illustrates the picture 's moral schizophrenia .;2
4863;8499;155269;It goes down easy , leaving virtually no aftertaste .;3
4864;7981;146707;It was only a matter of time before some savvy producer saw the potential success inherent in the mixture of Bullock Bubble and Hugh Goo .;3
4865;3100;61333;It also shows how deeply felt emotions can draw people together across the walls that might otherwise separate them .;3
4866;6718;124996;This rather unfocused , all-over-the-map movie would be a lot better if it pared down its plots and characters to a few rather than dozens ... or if it were subtler ... or if it had a sense of humor .;1
4867;483;11222;The moral shrapnel and mental shellshock will linger long after this film has ended .;3
4868;7558;139382;The Rules of Attraction gets us too drunk on the party favors to sober us up with the transparent attempts at moralizing .;1
4869;2808;56089;Simply does n't have sufficient heft to justify its two-hour running time .;2
4870;6407;119785;Exhibits the shallow sensationalism characteristic of soap opera ... more salacious telenovela than serious drama .;1
4871;1785;37562;A delightful , if minor , pastry of a movie .;4
4872;4320;83579;The following things are not at all entertaining : The bad sound , the lack of climax and , worst of all , watching Seinfeld -LRB- who is also one of the film 's producers -RRB- do everything he can to look like a good guy .;0
4873;7034;130549;Serviceable at best , slightly less than serviceable at worst .;2
4874;1345;29037;Though Frida is easier to swallow than Julie Taymor 's preposterous Titus , the eye candy here lacks considerable brio .;1
4875;8453;154598;Maybe not a classic , but a movie the kids will want to see over and over again .;4
4876;8484;155028;It made me want to get made-up and go see this movie with my sisters .;3
4877;6299;117921;The result is more depressing than liberating , but it 's never boring .;2
4878;3933;76512;as in aimless , arduous , and arbitrary .;1
4879;633;14679;Its impressive images of crematorium chimney fires and stacks of dead bodies are undermined by the movie 's presentation , which is way too stagy .;1
4880;6042;113651;It 's hard to care about a film that proposes as epic tragedy the plight of a callow rich boy who is forced to choose between his beautiful , self-satisfied 22-year-old girlfriend and an equally beautiful , self-satisfied 18-year-old mistress .;1
4881;7407;136941;... an interesting slice of history .;3
4882;472;11061;Definitely funny stuff , but it 's more of the ` laughing at ' variety than the ` laughing with . ';3
4883;5985;112705;The plot grows thin soon , and you find yourself praying for a quick resolution .;1
4884;6987;129815;insightfully written , delicately performed;4
4885;7851;144643;An off-beat and fanciful film about the human need for monsters to blame for all that is amiss in the world .;3
4886;2606;52609;The actresses may have worked up a back story for the women they portray so convincingly , but viewers do n't get enough of that background for the characters to be involving as individuals rather than types .;2
4887;6583;122691;It 's difficult to discern if this is a crazy work of disturbed genius or merely 90 minutes of post-adolescent Electra rebellion .;2
4888;3168;62620;If Sinise 's character had a brain his ordeal would be over in five minutes but instead the plot goes out of its way to introduce obstacles for him to stumble over .;2
4889;3671;71902;An uplifting drama ... What Antwone Fisher is n't , however , is original .;2
4890;6999;129996;A tasty masala .;3
4891;910;20363;This is one of the outstanding thrillers of recent years .;4
4892;5898;111227;Nothing more or less than an outright bodice-ripper -- it should have ditched the artsy pretensions and revelled in the entertaining shallows .;1
4893;3563;70003;Too slick and manufactured to claim street credibility .;1
4894;3158;62449;If it 's not entirely memorable , the movie is certainly easy to watch .;3
4895;8385;153532;So much about the film is loopy and ludicrous ... that it could have been a hoot in a bad-movie way if the laborious pacing and endless exposition had been tightened .;1
4896;2587;52312;The overall fabric is hypnotic , and Mr. Mattei fosters moments of spontaneous intimacy .;4
4897;5560;105309;Frankly , it 's pretty stupid .;1
