;SentenceId;PhraseId;Phrase;Sentiment
5604;5610;106241;By halfway through this picture I was beginning to hate it , and , of course , feeling guilty for it ... Then , miracle of miracles , the movie does a flip-flop .;1
5841;5848;110394;You 'll trudge out of the theater feeling as though you rode the Zipper after eating a corn dog and an extra-large cotton candy .;-1
5452;5458;103487;It 's not life-affirming -- its vulgar and mean , but I liked it .;0
5661;5667;107237;Its message has merit and , in the hands of a brutally honest individual like Prophet Jack , might have made a point or two regarding life .;-1
5402;5408;102666;And that should tell you everything you need to know about All the Queen 's Men .;0
6251;6260;117316;Birthday Girl does n't try to surprise us with plot twists , but rather seems to enjoy its own transparency .;1
5854;5861;110569;A loud , low-budget and tired formula film that arrives cloaked in the euphemism ` urban drama . ';-1
5858;5865;110682;A baffling subplot involving smuggling drugs inside Danish cows falls flat , and if you 're going to alter the Bard 's ending , you 'd better have a good alternative .;-1
5823;5830;110090;`` Sorority Boys '' was funnier , and that movie was pretty bad .;-1
6058;6066;114104;Fails in making this character understandable , in getting under her skin , in exploring motivation ... Well before the end , the film grows as dull as its characters , about whose fate it is hard to care .;-1
5472;5478;103879;Might best be enjoyed as a daytime soaper .;0
6252;6261;117334;A behind the scenes look at the training and dedication that goes into becoming a world-class fencer and the champion that 's made a difference to NYC inner-city youth .;0
5680;5686;107585;An incredibly narrow in-joke targeted to the tiniest segment of an already obscure demographic .;-1
6285;6294;117856;A heroic tale of persistence that is sure to win viewers ' hearts .;1
5762;5769;108977;Much like Robin Williams , Death to Smoochy has already reached its expiration date .;-1
5477;5483;103964;Berling and;0
5337;5343;101571;The camera whirls !;0
5521;5527;104663;` Tobey Maguire is a poster boy for the geek generation . ';0
6054;6062;114018;How I Killed My Father is one of those art house films that makes you feel like you 're watching an iceberg melt -- only it never melts .;0
5413;5419;102822;Your children will be occupied for 72 minutes .;1
5626;5632;106645;Dull and mechanical , kinda like a very goofy museum exhibit;0
6198;6206;116384;Watching Spirited Away is like watching an Eastern imagination explode .;0
6065;6073;114212;Merry friggin ' Christmas !;0
5881;5888;111095;An instance of an old dog not only learning but inventing a remarkable new trick .;1
5489;5495;104166;... it was n't the subject matter that ultimately defeated the film ... It was the unfulfilling , incongruous , `` wait a second , did I miss something ? '';-1
5672;5678;107465;A winning comedy with its wry observations about long-lived friendships and the ways in which we all lose track of ourselves by trying to please others .;1
5524;5530;104692;Meeting , even exceeding expectations , it 's the best sequel since The Empire Strikes Back ... a majestic achievement , an epic of astonishing grandeur and surprising emotional depth .;1
5832;5839;110254;This is a nervy , risky film , and Villeneuve has inspired Croze to give herself over completely to the tormented persona of Bibi .;0
5632;5638;106744;The main characters are simply named The Husband , The Wife and The Kidnapper , emphasizing the disappointingly generic nature of the entire effort .;-1
6036;6044;113701;It 's so crammed with scenes and vistas and pretty moments that it 's left a few crucial things out , like character development and coherence .;-1
6224;6233;116833;The film favors the scientific over the spectacular -LRB- visually speaking -RRB- .;0
5550;5556;105219;This is a sincerely crafted picture that deserves to emerge from the traffic jam of holiday movies .;1
5427;5433;103078;The best film of the year 2002 .;1
6016;6024;113361;This is the kind of movie during which you want to bang your head on the seat in front of you , at its cluelessness , at its idiocy , at its utterly misplaced earnestness .;-1
5602;5608;106183;In addition to Hoffman 's powerful acting clinic , this is that rare drama that offers a thoughtful and rewarding glimpse into the sort of heartache everyone has felt , or will feel someday .;1
6107;6115;114849;Perhaps the most annoying thing about Who Is Cletis Tout ?;0
5695;5702;107821;Do n't expect any subtlety from this latest entry in the increasingly threadbare gross-out comedy cycle .;0
5996;6004;113061;Offers laughs and insight into one of the toughest ages a kid can go through .;1
5471;5477;103874;It 's not a great monster movie .;-1
5408;5414;102752;Just about the best straight-up , old-school horror film of the last 15 years .;1
5591;5597;105998;With flashbulb editing as cover for the absence of narrative continuity , Undisputed is nearly incoherent , an excuse to get to the closing bout ... by which time it 's impossible to care who wins .;-1
6155;6163;115623;This fascinating look at Israel in ferment feels as immediate as the latest news footage from Gaza and , because of its heightened , well-shaped dramas , twice as powerful .;1
6307;6316;118241;It 's sweet .;1
6390;6400;119654;How about starting with a more original story instead of just slapping extreme humor and gross-out gags on top of the same old crap ?;0
5793;5800;109496;A film that should be relegated to a dark video store corner is somehow making its way instead to theaters .;-1
5820;5827;110027;It 's not going to be everyone 's bag of popcorn , but it definitely gives you something to chew on .;1
5984;5992;112843;You have no affinity for most of the characters .;-1
5894;5901;111290;Far away .;0
6090;6098;114615;The vistas are sweeping and the acting is far from painful .;0
5498;5504;104318;Michael Moore has perfected the art of highly entertaining , self-aggrandizing , politically motivated documentary-making , and he 's got as potent a topic as ever here .;1
6297;6306;118038;Passions , obsessions , and loneliest dark spots are pushed to their most virtuous limits , lending the narrative an unusually surreal tone .;1
5683;5689;107628;Some remarkable achival film about how Shanghai -LRB- of all places -RRB- served Jews who escaped the Holocaust .;1
5902;5909;111403;An original little film about one young woman 's education .;0
6229;6238;116906;Attal 's hang-ups surrounding infidelity are so old-fashioned and , dare I say , outdated , it 's a wonder that he could n't have brought something fresher to the proceedings simply by accident .;-1
6219;6227;116761;Cube 's charisma and chemistry compensate for corniness and cliche .;0
6318;6327;118425;The story is smart and entirely charming in intent and execution .;1
6341;6350;118802;Nohe has made a decent ` intro ' documentary , but he feels like a spectator and not a participant .;-1
6357;6367;119120;To work , love stories require the full emotional involvement and support of a viewer .;0
5579;5585;105795;Twenty years later , Reggio still knows how to make a point with poetic imagery , but his ability to startle has been stifled by the very prevalence of the fast-forward technology that he so stringently takes to task .;0
5499;5505;104347;Sometimes entertaining , sometimes indulgent -- but never less than pure wankery .;0
6008;6016;113231;A brain twister , less a movie-movie than a funny and weird meditation on Hollywood , success , artistic integrity and intellectual bankruptcy .;0
5521;5527;104663;` Tobey Maguire is a poster boy for the geek generation . ';0
6118;6126;115008;Sensitive ensemble performances and good period reconstruction add up to a moving tragedy with some buoyant human moments .;1
5399;5405;102627;A compelling yarn , but not quite a ripping one .;1
6369;6379;119325;is an inexpressible and drab wannabe looking for that exact niche .;-1
6254;6263;117378;Every now and again , a movie comes along to remind us of how very bad a motion picture can truly be .;-1
6247;6256;117252;This thing works on no level whatsoever for me .;-1
5396;5402;102608;The most consistently funny of the Austin Powers films .;1
5513;5519;104541;Essentially , the film is weak on detail and strong on personality;0
6304;6313;118186;George Clooney , in his first directorial effort , presents this utterly ridiculous shaggy dog story as one of the most creative , energetic and original comedies to hit the screen in years .;1
5882;5889;111111;Henry Bean 's thoughtful screenplay provides no easy answers , but offers a compelling investigation of faith versus intellect;1
5724;5731;108293;A big fat pain .;-1
5576;5582;105729;Schnitzler does a fine job contrasting the sleekness of the film 's present with the playful paranoia of the film 's past . ';1
6033;6041;113626;Too often , Son of the Bride becomes an exercise in trying to predict when a preordained `` big moment '' will occur and not `` if . '';-1
5497;5503;104309;For all the complications , it 's all surprisingly predictable .;0
5564;5570;105479;Not only does LeBlanc make one spectacularly ugly-looking broad , but he appears miserable throughout as he swaggers through his scenes .;-1
5807;5814;109727;Like The Rugrats movies , The Wild Thornberrys Movie does n't offer much more than the series , but its emphasis on caring for animals and respecting other cultures is particularly welcome .;1
5971;5979;112573;` The film is stark , straightforward and deadly ... an unnatural calm that 's occasionally shaken by ... blasts of rage , and later , violent jealousy . ';0
5747;5754;108699;First and foremost ... the reason to go see `` Blue Crush '' is the phenomenal , water-born cinematography by David Hennings .;1
5837;5844;110337;A good-natured ensemble comedy that tries hard to make the most of a bumper cast , but never quite gets off the ground .;-1
5537;5543;104921;From the choppy editing to the annoying score to ` special effects ' by way of replacing objects in a character 's hands below the camera line , `` Besotted '' is misbegotten;-1
6158;6166;115698;Turturro is fabulously funny and over the top as a ` very sneaky ' butler who excels in the art of impossible disappearing\/reappearing acts;1
6199;6207;116393;The entire point of a shaggy dog story , of course , is that it goes nowhere , and this is classic nowheresville in every sense .;-1
5488;5494;104159;Only for young children , if them .;0
6246;6255;117225;Kung Pow seems like some futile concoction that was developed hastily after Oedekerk and his fellow moviemakers got through crashing a college keg party .;-1
5401;5407;102653;If Signs is a good film , and it is , the essence of a great one is in there somewhere .;0
5713;5720;108114;No matter how you slice it , Mark Wahlberg and Thandie Newton are not Hepburn and Grant , two cinematic icons with chemistry galore .;0
5988;5996;112896;The storytelling may be ordinary , but the cast is one of those all-star reunions that fans of Gosford Park have come to assume is just another day of Brit cinema .;1
6034;6042;113651;It 's hard to care about a film that proposes as epic tragedy the plight of a callow rich boy who is forced to choose between his beautiful , self-satisfied 22-year-old girlfriend and an equally beautiful , self-satisfied 18-year-old mistress .;-1
5886;5893;111170;Shanghai Ghetto may not be as dramatic as Roman Polanski 's The Pianist , but its compassionate spirit soars every bit as high .;1
6286;6295;117870;Not the best Herzog perhaps , but unmistakably Herzog .;0
5821;5828;110042;I 'm not generally a fan of vegetables but this batch is pretty cute .;0
6072;6080;114303;Jarecki and Gibney do find enough material to bring Kissinger 's record into question and explain how the diplomat 's tweaked version of statecraft may have cost thousands and possibly millions of lives .;0
5636;5642;106822;Almost everything about the film is unsettling , from the preposterous hairpiece worn by Lai 's villainous father to the endless action sequences .;0
6035;6043;113695;I admit it , I hate to like it .;0
5770;5777;109095;Those who trek to the ` plex predisposed to like it probably will enjoy themselves .;1
6299;6308;118094;... one of the more influential works of the ` Korean New Wave ' .;1
5472;5478;103879;Might best be enjoyed as a daytime soaper .;0
5385;5391;102428;Not really a thriller so much as a movie for teens to laugh , groan and hiss at .;-1
5439;5445;103247;The screenwriters dig themselves in deeper every time they toss logic and science into what is essentially a `` Dungeons and Dragons '' fantasy with modern military weaponry ...;-1
5522;5528;104677;With Freeman and Judd , I 'll at least remember their characters .;0
5601;5607;106168;An affectionately goofy satire that 's unafraid to throw elbows when necessary ...;1
6175;6183;115996;Suffice to say that after seeing this movie in IMAX form , you 'll be more acquainted with the tiniest details of Tom Hanks ' face than his wife is .;0
5639;5645;106883;While the ensemble player who gained notice in Guy Ritchie 's Lock , Stock and Two Smoking Barrels and Snatch has the bod , he 's unlikely to become a household name on the basis of his first starring vehicle .;-1
5992;6000;112985;Too campy to work as straight drama and too violent and sordid to function as comedy , Vulgar is , truly and thankfully , a one-of-a-kind work .;-1
5432;5438;103116;Vulgar is too optimistic a title .;-1
5896;5903;111317;Unfortunately , the experience of actually watching the movie is less compelling than the circumstances of its making .;-1
5784;5791;109343;Crush is so warm and fuzzy you might be able to forgive its mean-spirited second half .;1
5339;5345;101581;What makes the movie special is its utter sincerity .;1
6217;6225;116736;Mr. Koshashvili is a director to watch .;1
5954;5962;112274;An animation landmark as monumental as Disney 's 1937 breakthrough Snow White and the Seven Dwarfs .;1
6048;6056;113917;Allen shows he can outgag any of those young whippersnappers making moving pictures today .;1
6164;6172;115836;`` Juwanna Mann ? '';0
5759;5766;108915;It 's difficult for a longtime admirer of his work to not be swept up in Invincible and overlook its drawbacks .;0
6258;6267;117440;This mistaken-identity picture is so film-culture referential that the final product is a ghost .;-1
5721;5728;108261;Bacon keeps things interesting , but do n't go out of your way to pay full price .;0
5733;5740;108466;A coming-of-age tale from New Zealand whose boozy , languid air is balanced by a rich visual clarity and deeply felt performances across the board .;1
5737;5744;108525;A devastating indictment of unbridled greed and materalism .;-1
5403;5409;102677;- spy action flick with Antonio Banderas and Lucy Liu never comes together .;-1
5334;5340;101540;Really does feel like a short stretched out to feature length .;-1
6136;6144;115333;Gangs , despite the gravity of its subject matter , is often as fun to watch as a good spaghetti western .;0
6265;6274;117557;The film makes strong arguments regarding the social status of America 's indigenous people , but really only exists to try to eke out an emotional tug of the heart , one which it fails to get .;0
5652;5658;107093;As the Mediterranean sparkles , ` Swept Away ' sinks .;-1
5930;5938;111862;Underachieves only in not taking the Shakespeare parallels quite far enough .;0
5382;5388;102386;Feardotcom 's thrills are all cheap , but they mostly work .;0
5443;5449;103333;A sterling film - a cross between Boys Do n't Cry , Deliverance , and Ode to Billy Joe - lies somewhere in the story of Matthew Shepard , but that film is yet to be made .;0
5816;5823;109920;Been there , done that , liked it much better the first time around - when it was called The Professional .;-1
5426;5432;103056;It briefly flirts with player masochism , but the point of real interest - -- audience sadism -- is evaded completely .;0
5637;5643;106844;An older cad instructs a younger lad in Zen and the art of getting laid in this prickly indie comedy of manners and misanthropy .;1
6168;6176;115867;The solid filmmaking and convincing characters makes this a high water mark for this genre .;1
6029;6037;113556;The casting of von Sydow ... is itself Intacto 's luckiest stroke .;1
5558;5564;105356;Vividly conveys the shadow side of the 30-year friendship between two English women .;0
6350;6360;118982;Releasing a film with the word ` dog ' in its title in January lends itself to easy jokes and insults , and Snow Dogs deserves every single one of them .;-1
5777;5784;109220;Hart 's War seems to want to be a character study , but apparently ca n't quite decide which character .;-1
6187;6195;116243;The slam-bang superheroics are kinetic enough to engross even the most antsy youngsters .;1
5890;5897;111216;An entertaining British hybrid of comedy , caper thrills and quirky romance .;1
5536;5542;104912;Some stunning visuals -- and some staggeringly boring cinema .;0
6024;6032;113470;an essentially awkward version of the lightweight female empowerment picture we 've been watching for decades;-1
6352;6362;119018;... has its moments , but ultimately , its curmudgeon does n't quite make the cut of being placed on any list of favorites .;0
6354;6364;119053;There 's undeniable enjoyment to be had from films crammed with movie references , but the fun wears thin -- then out -- when there 's nothing else happening .;1
5583;5589;105886;You emerge dazed , confused as to whether you 've seen pornography or documentary .;-1
5778;5785;109238;Contrived , awkward and filled with unintended laughs , the film shows signs that someone other than the director got into the editing room and tried to improve things by making the movie go faster .;-1
5454;5460;103517;To call this one an eventual cult classic would be an understatement , and woe is the horror fan who opts to overlook this goofily endearing and well-lensed gorefest .;1
6315;6324;118390;It must be in the genes .;0
5382;5388;102386;Feardotcom 's thrills are all cheap , but they mostly work .;0
6256;6265;117408;I still want my money back .;-1
5825;5832;110132;I have n't seen such self-amused trash since Freddy Got Fingered .;-1
5566;5572;105517;A sleep-inducingly slow-paced crime drama with clumsy dialogue , heavy-handed phoney-feeling sentiment , and an overly-familiar set of plot devices .;-1
5840;5847;110386;What results is the best performance from either in years .;1
5627;5633;106655;You know that ten bucks you 'd spend on a ticket ?;0
6266;6275;117592;Spreads itself too thin , leaving these actors , as well as the members of the commune , short of profound characterizations;-1
5867;5874;110850;Cox creates a fluid and mesmerizing sequence of images to match the words of Nijinsky 's diaries .;1
5699;5706;107877;Brings an irresistible blend of warmth and humor and a consistent embracing humanity in the face of life 's harshness .;1
5518;5524;104599;It comes off as so silly that you would n't be surprised if BA , Murdock and rest of the A-Team were seen giving chase in a black and red van .;0
5577;5583;105747;A horror movie with seriously dumb characters , which somewhat dilutes the pleasure of watching them stalked by creepy-crawly bug things that live only in the darkness .;-1
5902;5909;111403;An original little film about one young woman 's education .;0
5843;5850;110433;Yes , but also intriguing and honorable , a worthwhile addition to a distinguished film legacy .;1
5916;5924;111613;The film has an infectious enthusiasm and we 're touched by the film 's conviction that all life centered on that place , that time and that sport .;1
6287;6296;117880;All mood and no movie .;-1
6191;6199;116281;Needed a little less bling-bling and a lot more romance .;-1
6127;6135;115179;It is just too bad the film 's story does not live up to its style .;-1
5565;5571;105500;The climactic events are so well realized that you may forget all about the original conflict , just like the movie does;0
6032;6040;113604;A crisp psychological drama -LRB- and -RRB- a fascinating little thriller that would have been perfect for an old `` Twilight Zone '' episode .;1
5491;5497;104216;... comes alive only when it switches gears to the sentimental .;-1
6395;6405;119757;The mantra behind the project seems to have been ` it 's just a kids ' flick . ';-1
5750;5757;108761;It 's not too fast and not too slow .;1
5649;5655;107055;` Alice 's adventure through the looking glass and into zombie-land ' is filled with strange and wonderful creatures .;1
5504;5510;104414;Wonder , hope and magic can never escape the heart of the boy when the right movie comes along , especially if it begins with the name of Star Wars;1
6352;6362;119018;... has its moments , but ultimately , its curmudgeon does n't quite make the cut of being placed on any list of favorites .;0
5715;5722;108160;Dripping with cliche and bypassing no opportunity to trivialize the material .;-1
6130;6138;115233;Does anyone much think the central story of Brendan Behan is that he was a bisexual sweetheart before he took to drink ?;0
6157;6165;115695;Nice piece of work .;1
5861;5868;110755;... a low rate Annie featuring some kid who ca n't act , only echoes of Jordan , and weirdo actor Crispin Glover screwing things up old school .;-1
6046;6054;113882;Oedekerk mugs mercilessly , and the genuinely funny jokes are few and far between .;-1
5378;5384;102301;The package in which this fascinating -- and timely -- content comes wrapped is disappointingly generic .;-1
6235;6244;117033;So earnest and well-meaning , and so stocked with talent , that you almost forget the sheer , ponderous awfulness of its script .;0
5878;5885;111042;The film starts promisingly , but the ending is all too predictable and far too cliched to really work .;-1
6334;6343;118675;It 's harmless , diverting fluff .;0
6358;6368;119134;Adams , with four scriptwriters , takes care with the characters , who are so believable that you feel what they feel .;1
5599;5605;106126;The film falls short on tension , eloquence , spiritual challenge -- things that have made the original New Testament stories so compelling for 20 centuries .;-1
6110;6118;114880;Instead of building to a laugh riot we are left with a handful of disparate funny moments of no real consequence .;-1
5906;5913;111460;In his latest effort , Storytelling , Solondz has finally made a movie that is n't just offensive -- it also happens to be good .;1
5361;5367;101965;The film has the courage of its convictions and excellent performances on its side .;1
6143;6151;115444;In the end , the film feels homogenized and a bit contrived , as if we 're looking back at a tattered and ugly past with rose-tinted glasses .;-1
6098;6106;114731;A movie that falls victim to frazzled wackiness and frayed satire .;0
5768;5775;109045;scenario that will give most parents pause ... Then , something terrible happens .;0
5509;5515;104501;The picture emerges as a surprisingly anemic disappointment .;-1
5380;5386;102318;For most of its footage , the new thriller proves that director M. Night Shyamalan can weave an eerie spell and that Mel Gibson can gasp , shudder and even tremble without losing his machismo .;1
5658;5664;107177;Its story about a young Chinese woman , Ah Na , who has come to New York City to replace past tragedy with the American Dream is one that any art-house moviegoer is likely to find compelling .;1
5641;5647;106937;meanders between its powerful moments .;0
5789;5796;109436;Although tender and touching , the movie would have benefited from a little more dramatic tension and some more editing .;0
5656;5662;107156;Nicole Kidman makes it a party worth attending .;1
5523;5529;104687;A Lifetime movie about men .;0
5511;5517;104528;` It looks good , Sonny , but you missed the point . ';-1
6031;6039;113585;-LRB- Caine -RRB- proves once again he has n't lost his touch , bringing off a superb performance in an admittedly middling film .;1
6275;6284;117710;This may be Dover Kosashvili 's feature directing debut , but it looks an awful lot like life -- gritty , awkward and ironic .;0
5698;5705;107868;A film that suffers because of its many excesses .;-1
5909;5917;111508;It 's the movie equivalent of a sweaty old guy in a rain coat shopping for cheap porn .;0
5701;5708;107922;Its screenplay serves as auto-critique , and its clumsiness as its own most damning censure .;-1
5705;5712;107970;Feels as if the inmates have actually taken over the asylum .;0
5404;5410;102691;` Dragonfly ' dwells on crossing-over mumbo jumbo , manipulative sentimentality , and sappy dialogue .;-1
5646;5652;107022;... could easily be called the best Korean film of 2002 .;1
5553;5559;105281;While the new film is much more eye-catching than its blood-drenched Stephen Norrington-directed predecessor , the new script by the returning David S. Goyer is much sillier .;0
6355;6365;119080;Each punch seen through prison bars , the fights become not so much a struggle of man vs. man as Brother-Man vs. The Man .;0
6042;6050;113833;If there ai n't none , you have a problem .;0
5365;5371;102032;Whether our action-and-popcorn obsessed culture will embrace this engaging and literate psychodrama is n't much of a mystery , unfortunately .;0
5856;5863;110599;When -LRB- Reno -RRB- lets her radical flag fly , taking angry potshots at George W. Bush , Henry Kissinger , Larry King , et al. , Reno devolves into a laugh-free lecture .;-1
6022;6030;113455;The film 's thoroughly recycled plot and tiresome jokes ... drag the movie down .;-1
5623;5629;106579;The kind of film that leaves you scratching your head in amazement over the fact that so many talented people could participate in such an ill-advised and poorly executed idea .;-1
6316;6325;118397;His scenes are short and often unexpected .;0
5928;5936;111838;It 's mindless junk like this that makes you appreciate original romantic comedies like Punch-Drunk Love .;0
